file_name,uni,wylie,url,dept,grade,char_len,audio_len,path,inf
STT_NW0121_0034_244958_to_253635,དེ་ནས་ཁེ་ས་འབྲུག་ཡུལ་ནང་ལྷོ་ཨེ་ཤི་ཡའི་མཐུན་ཚོགས་ཀི་ཚོགས་ཆེན་མཇུག་སྒྲིལ་འདུག ཞིབ་ཕྲ་ཚེ་བརྟན་དབང་ཕྱུག་ལགས་ཀིས་ངོ་སྤྲོད་གནང་གི་རེད། རྒྱུན་དུ་འབྲུག་རྒྱལ་ཁབ་དེ་ནི་ ,de nas khe sa 'brug yul nang lho e shi ya'i mthun tshogs ki tshogs chen mjug sgril 'dug_zhib phra tshe brtan dbang phyug lags kis ngo sprod gnang gi red/_rgyun du 'brug rgyal khab de ni _,https://d38pmlk0v88drf.cloudfront.net/wav16k/STT_NW0121_0034_244958_to_253635.wav,STT_NW,2,159,8.677,wav16k/STT_NW0121_0034_244958_to_253635.wav,དེ་ནས་ཁ་སང་འབྲུག་ཡུལ་ནང་ལྷོ་ཨེ་ཤེ་ཡའི་མཐུན་ཚོགས་ཀི་ཚོགས་ཆེན་མཇུག་སྒྲིལ་འདུག ཞིབ་ཕྲ་ཚེ་བརྟན་དབང་ཕྱུག་ལགས་ཀིས་ངོ་སྤྲོད་གནང་གི་རེད། རྒྱུན་དུ་འབྲུག་རྒྱལ་ཁབ་འདི་ནི་
STT_NW0121_0035_253635_to_258849,རྒྱལ་སྤྱིའི་གནད་དོན་ཐད་ལ་ཐེ་བྱུས་བྱེད་འདོད་མེད་མཁན་གི་རྒྱལ་ཁབ་ཞིག་ལ་ངོས་འཛིན་བྱེད་ཀི་ཡོད་ན་ཡང་།  ,rgyal spyi'i gnad don thad la the byus byed 'dod med mkhan gi rgyal khab zhig la ngos 'dzin byed ki yod na yang /__,https://d38pmlk0v88drf.cloudfront.net/wav16k/STT_NW0121_0035_253635_to_258849.wav,STT_NW,2,97,5.214,wav16k/STT_NW0121_0035_253635_to_258849.wav,རྒྱལ་སྤྱིའི་གནད་དོན་ཐད་ལ་ཐེ་ཇུས་བྱེད་འདོད་མེད་མཁན་གི་རྒྱལ་ཁབ་ཅིག་ལ་ངོས་འཛིན་བྱེད་ཀི་ཡོད་ན་ཡང་།
STT_NW0121_0036_258849_to_260339,འདས་པའི་ཉིན་ཤས་རིང་ ,'das pa'i nyin shas ring _,https://d38pmlk0v88drf.cloudfront.net/wav16k/STT_NW0121_0036_258849_to_260339.wav,STT_NW,2,20,1.49,wav16k/STT_NW0121_0036_258849_to_260339.wav,འདས་པའི་ཉིན་ཤས་རིང་
STT_NW0121_0037_260339_to_267561,ལྷོ་ཨེ་ཤི་ཡའི་རྒྱལ་ཁབ་ཀི་མཉམ་ལས་མཐུན་ཚོགས་ཀི་ཚོགས་འདུ་ཐེངས་བཅོ་དྲུག་པ་དེ་འབྲུག་གི་རྒྱལ་ས་ཐིམ་པུར་སྐོང་ཚོགས་བྱས་ཡོད་པ་དང་།  ,lho e shi ya'i rgyal khab ki mnyam las mthun tshogs ki tshogs 'du thengs bco drug pa de 'brug gi rgyal sa thim pur skong tshogs byas yod pa dang /__,https://d38pmlk0v88drf.cloudfront.net/wav16k/STT_NW0121_0037_260339_to_267561.wav,STT_NW,2,123,7.222,wav16k/STT_NW0121_0037_260339_to_267561.wav,ལྷོ་ཨེ་ཤེ་ཡའི་རྒྱལ་ཁབ་ཀི་མཉམ་ལས་མཐུན་ཚོགས་ཀི་ཚོགས་འདུ་ཐེངས་བཅུ་དྲུག་པ་དེ་འབྲུག་གི་རྒྱལ་ས་དེམ་བུར་སྐོག་ཚོགས་བྱས་ཡོད་པ་དང་།
STT_NW0121_0038_267561_to_274494,ད་རེས་ཀི་ལྷན་ཚོགས་འདིར་ཤར་ཨེ་ཤི་ཡའི་ཡུལ་གྲུ་ཁག་གི་དབུ་ཁྲིད་མང་ཆེ་བ་ཕེབས་ཡོད་པས། དེ་ནི་འབྲུག་ཡུལ་གི་ ,da res ki lhan tshogs 'dir shar e shi ya'i yul gru khag gi dbu khrid mang che ba phebs yod pas/_de ni 'brug yul gi _,https://d38pmlk0v88drf.cloudfront.net/wav16k/STT_NW0121_0038_267561_to_274494.wav,STT_NW,2,100,6.933,wav16k/STT_NW0121_0038_267561_to_274494.wav,ད་རེས་ཀི་ལྷན་ཚོགས་འདིར། ་ཤར་ཨེ་ཤེ་ཡའི་ཡུལ་གྲུ་ཁག་གི་དབུ་ཁྲིད་མང་ཆེ་བ་ཕེབས་ཡོད་པས། དེ་ནི་འབྲུག་ཡུལ་གི་
STT_NW0121_0039_274494_to_279310,རྒྱལ་སྤྱིའི་ལྷན་ཚོགས་གལ་ཆེན་པོ་དེ་ལྟ་བུ་ཞིག་མགྲོན་བདག་བྱས་པ་ཐེངས་དང་པོ་ཡིན་པ་མ་ཟད།  ,rgyal spyi'i lhan tshogs gal chen po de lta bu zhig mgron bdag byas pa thengs dang po yin pa ma zad/__,https://d38pmlk0v88drf.cloudfront.net/wav16k/STT_NW0121_0039_274494_to_279310.wav,STT_NW,2,84,4.816,wav16k/STT_NW0121_0039_274494_to_279310.wav,རྒྱལ་སྤྱིའི་ལྷན་ཚོགས་གལ་ཆེན་པོ་དེ་ལྟ་བུ་ཞིག་མགྲོན་བརྡག་བྱས་པ་ཐེངས་དང་པོ་ཡིན་པ་མ་ཟད།
STT_NW0121_0040_279310_to_288740,ཕྱི་རྒྱལ་གི་དབུ་ཁྲིད་གལ་ཆེན་པོ་མང་པོ་དེ་ཙམ་དུས་གཅིག་ཏུ་འབྲུག་ཡུལ་ལ་ཕེབས་ཡ་ཐེངས་དང་པོ་ཆགས་ཀི་ཡོད་པས། སྲིད་དོན་ཉམས་ཞིབ་པ་ཚོས་ད་རེས་ཀི་གནས་ཚུལ་འདི་ལས་ ,phyi rgyal gi dbu khrid gal chen po mang po de tsam dus gcig tu 'brug yul la phebs ya thengs dang po chags ki yod pas/_srid don nyams zhib pa tshos da res ki gnas tshul 'di las _,https://d38pmlk0v88drf.cloudfront.net/wav16k/STT_NW0121_0040_279310_to_288740.wav,STT_NW,2,148,9.43,wav16k/STT_NW0121_0040_279310_to_288740.wav,ཕྱི་རྒྱལ་གི་དབུ་ཁྲིད་གལ་ཆེན་པོ་མང་པོ་དེ་ཙམ་དུས་གཅིག་ཏུ་འགྲོ་རྒྱུ་ལ་ཕེབས་པ་ཡང་ཐེངས་དང་པོ་ཆགས་ཀི་ཡོད་པས། སྲིད་དོན་ཉམས་ཞིབ་པ་ཚོས། ད་རེས་ཀི་གནས་ཚུལ་དེ་ལས་
STT_NW0121_0041_288740_to_291323,འབྲུག་ཡུལ་གི་དམངས་གཙོའི་གཞུང་གསར་པ་འདི་ ,'brug yul gi dmangs gtso'i gzhung gsar pa 'di _,https://d38pmlk0v88drf.cloudfront.net/wav16k/STT_NW0121_0041_288740_to_291323.wav,STT_NW,2,40,2.583,wav16k/STT_NW0121_0041_288740_to_291323.wav,འབྲུག་ཡུལ་གི་དམང་གཙོའི་གཞུང་གསར་པ་དེ་
STT_NW0121_0042_291323_to_299726,རྒྱལ་སྤྱིའི་གནད་དོན་ཐད་ལ་ནུས་པ་དེ་སྔ་དང་མི་འདྲ་བ་ཆེ་ཙམ་ཞིག་འདོན་རྒྱུའི་ཕྱི་འབྲེལ་གི་ལངས་ཕྱོགས་གསར་པ་ཞིག་ལ་བསྐྱོད་ཀི་ཡོད་པར་ངོས་འཛིན་བྱས་འདུག ,rgyal spyi'i gnad don thad la nus pa de snga dang mi 'dra ba che tsam zhig 'don rgyu'i phyi 'brel gi langs phyogs gsar pa zhig la bskyod ki yod par ngos 'dzin byas 'dug_,https://d38pmlk0v88drf.cloudfront.net/wav16k/STT_NW0121_0042_291323_to_299726.wav,STT_NW,2,141,8.403,wav16k/STT_NW0121_0042_291323_to_299726.wav,རྒྱལ་སྤྱིའི་གནད་དོན་ཐད་ལ་ནུས་པ་དེ་སྔ་དང་མི་འདྲ་བ་ཆེ་ཙམ་ཞིག་འདུན་རྒྱུའི་ཕྱི་འབྲེལ་གི་ལངས་ཕྱོགས་གསར་པ་ཞིག་ལ་བསྐྱོད་ཀི་ཡོད་པར་ངོས་འཛིན་བྱས་འདུག
STT_NW0121_0043_299726_to_301649,ལྷན་ཚོགས་དེའི་སར་ ,lhan tshogs de'i sar _,https://d38pmlk0v88drf.cloudfront.net/wav16k/STT_NW0121_0043_299726_to_301649.wav,STT_NW,2,18,1.923,wav16k/STT_NW0121_0043_299726_to_301649.wav,ལྷན་ཚོགས་དེའི་སར་
STT_NW0121_0044_301649_to_305005,རྒྱལ་ཁབ་ཁག་གི་དབུ་ཁྲིད་ཚོས་ལྷོ་ཨེ་ཤི་ཡའི་དཔལ་འབྱོར་དང་ ,rgyal khab khag gi dbu khrid tshos lho e shi ya'i dpal 'byor dang _,https://d38pmlk0v88drf.cloudfront.net/wav16k/STT_NW0121_0044_301649_to_305005.wav,STT_NW,2,55,3.356,wav16k/STT_NW0121_0044_301649_to_305005.wav,རྒྱལ་ཁབ་ཁག་གི་དབུ་ཁྲིད་ཚོས་ ལྷོ་ཨེ་ཤེ་ཡའི་དཔལ་འབྱོར་དང་
STT_NW0121_0045_305005_to_312038,ཁོར་ཡུག་སོགས་ཀི་གནད་དོན་ཐད་ལ་གྲོས་མོལ་གནང་སྟེ་གནད་དོན་དེ་ཚོའི་ཐད་ལ་མཉམ་ལས་བྱེད་རྒྱུའི་གྲོས་མཐུན་ཞིག་ཀྱང་བཞག་འདུག ,khor yug sogs ki gnad don thad la gros mol gnang ste gnad don de tsho'i thad la mnyam las byed rgyu'i gros mthun zhig kyang bzhag 'dug_,https://d38pmlk0v88drf.cloudfront.net/wav16k/STT_NW0121_0045_305005_to_312038.wav,STT_NW,2,113,7.033,wav16k/STT_NW0121_0045_305005_to_312038.wav,ཁོར་ཡུག་སོགས་ཀི་གནད་དོན་ཐད་ལ་གྲོས་མོལ་གནང་སྟེ། གནད་དོན་དེ་ཚོའི་ཐད་ལ་མཉམ་ལས་བྱེད་རྒྱུའི་གྲོས་མཐུན་ཞིག་ཡང་བཞག་འདུག
STT_NW0121_0046_312038_to_314378,ཡང་ཆེས་མཐོའི་ལྷན་ཚོགས་དེའི་ཟུར་དུ་ ,yang ches mtho'i lhan tshogs de'i zur du _,https://d38pmlk0v88drf.cloudfront.net/wav16k/STT_NW0121_0046_312038_to_314378.wav,STT_NW,2,35,2.34,wav16k/STT_NW0121_0046_312038_to_314378.wav,ཡང་ཆིས་མཐོའི་ལྷན་ཚོགས་དེའི་ཟུར་དུ་
STT_NW0121_0047_314378_to_319478,རྒྱ་གར་གི་སྲིད་བློན་མཆོག་དང་པ་ཀི་སི་ཐན་གི་དབུ་ཁྲིད་བར་མཇལ་འཔྲད་གྲོས་མོལ་གནང་འདུག་པ་དེ་ནི་ ,rgya gar gi srid blon mchog dang pa ki si than gi dbu khrid bar mjal 'aprad gros mol gnang 'dug pa de ni _,https://d38pmlk0v88drf.cloudfront.net/wav16k/STT_NW0121_0047_314378_to_319478.wav,STT_NW,2,90,5.1,wav16k/STT_NW0121_0047_314378_to_319478.wav,རྒྱ་གར་གི་སྲིད་བློན་མཆོག་དང་། པ་ཀི་སི་ཐན་གི་དབུ་ཁྲིད་བར་མཇལ་འཕྲད་གྲོས་མོལ་གནང་འདུག་པ་དེ་ནི།
STT_NW0121_0048_319478_to_326514,ལྷོ་ཨེ་ཤི་ཡའི་ནང་གི་རྒྱལ་ཁབ་གལ་ཆེ་ཤོས་དེ་གཉིས་ཀི་འབྲེལ་བ་ཡར་རྒྱས་གཏོང་རྒྱུའི་འབད་བརྩོན་གལ་ཆེན་པོ་ཞིག་ཡིན་པར་ངོས་འཛིན་བྱས་འདུག ,lho e shi ya'i nang gi rgyal khab gal che shos de gnyis ki 'brel ba yar rgyas gtong rgyu'i 'bad brtson gal chen po zhig yin par ngos 'dzin byas 'dug_,https://d38pmlk0v88drf.cloudfront.net/wav16k/STT_NW0121_0048_319478_to_326514.wav,STT_NW,2,126,7.036,wav16k/STT_NW0121_0048_319478_to_326514.wav,ལྷོ་ཨེ་ཤེ་ཡའི་ནང་གི་རྒྱལ་ཁབ་གལ་ཆེ་ཤོས་དེ་གཉིས་ཀི་འབྲེལ་བ་ཡར་རྒྱས་གཏོང་རྒྱུའི་འབད་བརྩོན་གལ་ཆེན་པོ་ཞིག་ཡིན་པར་ངོས་འཛིན་བྱས་འདུག
STT_NW0121_0049_326514_to_333880,དེ་ཡང་མཇལ་འཛོམས་དེ་མཇུག་སྒྲིལ་བའི་སྐབས་རྒྱ་གར་གི་ཕྱི་སྲིད་དྲུང་ཆེ་ནི་རུ་པ་མ་རའོ་ཡིས་གསར་འགོད་པ་ཚོར་བརྗོད་དོན།  ,de yang mjal 'dzoms de mjug sgril ba'i skabs rgya gar gi phyi srid drung che ni ru pa ma ra'o yis gsar 'god pa tshor brjod don/__,https://d38pmlk0v88drf.cloudfront.net/wav16k/STT_NW0121_0049_326514_to_333880.wav,STT_NW,2,111,7.366,wav16k/STT_NW0121_0049_326514_to_333880.wav,དེ་ཡང་མཇལ་འཛོམས་དེ་མཇུག་སྒྲིལ་བའི་སྐབས་ རྒྱ་གར་གི་ཕྱི་སྲིད་དྲུང་ཆེ་ནེ་རུ་པྨ་རའོ་ཡིས་གསར་འགོད་པ་ཚོར་བརྗོད་དོན།
STT_NW0121_0050_337749_to_347728,རྒྱ་གར་དང་པ་ཀི་སི་ཐན་གི་དབུ་ཁྲིད་གཉིས་བར་མཇལ་འཛོམས་གནང་སྐབས། རིང་མིན་རྒྱལ་ཁབ་གཉིས་ཀི་ཕྱི་སྲིད་བློན་ཆེན་བར་ཐད་ཀར་གྲོས་མོལ་བྱས་ཏེ་རྒྱལ་ཁབ་གཉིས་བར་གི་ཕན་ཚུན་ཡིད་ཆེས་ཆེ་རུ་བཏང་ནས་ ,rgya gar dang pa ki si than gi dbu khrid gnyis bar mjal 'dzoms gnang skabs/_ring min rgyal khab gnyis ki phyi srid blon chen bar thad kar gros mol byas te rgyal khab gnyis bar gi phan tshun yid ches che ru btang nas _,https://d38pmlk0v88drf.cloudfront.net/wav16k/STT_NW0121_0050_337749_to_347728.wav,STT_NW,2,176,9.979,wav16k/STT_NW0121_0050_337749_to_347728.wav,རྒྱ་གར་དང་པ་ཀི་སི་ཐན་གི་དབུ་ཁྲིད་གཉིས་བར་མཇལ་འཛོམས་གནང་སྐབས། རིང་མིན་རྒྱལ་ཁབ་གཉིས་ཀིས་ཕྱི་སྲིད་བློན་ཆེན་བར་ཐད་ཀར་གྲོས་མོལ་བྱས་ཏེ། རྒྱལ་ཁབ་གཉིས་བར་གི་ཕན་ཚུན་ཡིད་ཆེས་ཆེ་རུ་བཏང་ནས་
STT_NW0121_0051_347728_to_356444,མཐར་དོན་སྙིང་ལྡན་པའི་གྲོས་མོལ་བརྒྱུད་དེ་རྒྱ་གར་དང་པ་ཀི་སི་ཐན་གི་འབྲེལ་བ་ཡར་རྒྱས་གཏོང་རྒྱུར་མོས་མཐུན་གནང་སོང་ཅེས་བརྗོད་འདུག ,mthar don snying ldan pa'i gros mol brgyud de rgya gar dang pa ki si than gi 'brel ba yar rgyas gtong rgyur mos mthun gnang song ces brjod 'dug_,https://d38pmlk0v88drf.cloudfront.net/wav16k/STT_NW0121_0051_347728_to_356444.wav,STT_NW,2,123,8.716,wav16k/STT_NW0121_0051_347728_to_356444.wav,མཐར་དོན་སྙིང་ལྡན་པའི་གྲོས་མོལ་བརྒྱུད་དེ་ རྒྱ་གར་དང་པ་ཀི་སི་ཐན་གིས་འབྲེལ་བ་ཡར་རྒྱས་གཏོང་རྒྱུར་མོས་མཐུན་གནང་སོང་ཅེས་བརྗོད་འདུག
STT_NW0121_0052_359779_to_363480,རེས་གཟའ་ཕུར་བུའི་ཉིན་རྒྱལ་སྤྱིའི་ལྷན་ཚོགས་དེ་མཇུག་མ་སྒྲིལ་གོང་ ,res gza' phur bu'i nyin rgyal spyi'i lhan tshogs de mjug ma sgril gong _,https://d38pmlk0v88drf.cloudfront.net/wav16k/STT_NW0121_0052_359779_to_363480.wav,STT_NW,2,63,3.701,wav16k/STT_NW0121_0052_359779_to_363480.wav,རེས་གཟའ་ཕུར་བུའི་ཉིན་རྒྱལ་སྤྱིའི་ལྷན་ཚོགས་དེ་མཇུག་མ་སྒྲིལ་གོང་།
STT_NW0121_0053_363480_to_368085,ལྷོ་ཨེ་ཤི་ཡའི་རྒྱལ་ཁབ་ཁག་གི་ཆེས་མཐོའི་དབུ་ཁྲིད་རྣམས་མཉམ་ཞུགས་ཀིས་མཛད་སྒོ་ཞིག་གི་ཐོག་ ,lho e shi ya'i rgyal khab khag gi ches mtho'i dbu khrid rnams mnyam zhugs kis mdzad sgo zhig gi thog _,https://d38pmlk0v88drf.cloudfront.net/wav16k/STT_NW0121_0053_363480_to_368085.wav,STT_NW,2,85,4.605,wav16k/STT_NW0121_0053_363480_to_368085.wav,ལྷོ་ཨེ་ཤེ་ཡའི་རྒྱལ་ཁབ་ཁག་གི་ཆེས་མཐོའི་དབུ་ཁྲིད་རྣམས་མཉམ་ཞུགས་ཀིས་མཛད་སྒོ་ཞིག་གི་ཐོག་
STT_NW0121_0054_368085_to_370317,འབྲུག་ཡུལ་གི་སྲོལ་རྒྱུན་བཞིན་ ,'brug yul gi srol rgyun bzhin _,https://d38pmlk0v88drf.cloudfront.net/wav16k/STT_NW0121_0054_368085_to_370317.wav,STT_NW,2,30,2.232,wav16k/STT_NW0121_0054_368085_to_370317.wav,འབྲུག་ཡུལ་གི་སྲོལ་རྒྱུན་བཞིན་
STT_NW0121_0055_370317_to_371755,དར་ཆེན་བཙུགས་པ་དང་ ,dar chen btsugs pa dang _,https://d38pmlk0v88drf.cloudfront.net/wav16k/STT_NW0121_0055_370317_to_371755.wav,STT_NW,2,19,1.438,wav16k/STT_NW0121_0055_370317_to_371755.wav,དར་ཆེན་བཙུགས་པ་དང་
STT_NW0121_0056_371755_to_380382,རབ་གནས་ཐུགས་སྨོན་སོགས་ཡང་གནང་འདུག ལྷན་ཚོགས་ཀི་ཉིན་མཐའ་མ་དེར་ ,rab gnas thugs smon sogs yang gnang 'dug_lhan tshogs ki nyin mtha' ma der _,https://d38pmlk0v88drf.cloudfront.net/wav16k/STT_NW0121_0056_371755_to_380382.wav,STT_NW,2,61,8.627,wav16k/STT_NW0121_0056_371755_to_380382.wav,རབ་གནས་ཐུགས་སྨོན་སོགས་ཡང་གནང་ལྷན་ཚོགས་ཀི་ཉིན་མཐའ་མ་ྟབུ།
STT_NW0121_0057_380382_to_387534,འབྲུག་རྒྱལ་ཁབ་ཀི་བློན་ཆེན་འཇིགས་མེད་འཕྲིན་ལས་མཆོག་གིས་ཐེངས་འདིའི་ལྷོ་ཨེ་ཤི་ཡའི་མཐུན་ཚོགས་དེ་མཇུག་བསྒྲིལ་བའི་གསལ་བསྒྲགས་གནང་འདུག ,'brug rgyal khab ki blon chen 'jigs med 'phrin las mchog gis thengs 'di'i lho e shi ya'i mthun tshogs de mjug bsgril ba'i gsal bsgrags gnang 'dug_,https://d38pmlk0v88drf.cloudfront.net/wav16k/STT_NW0121_0057_380382_to_387534.wav,STT_NW,2,128,7.152,wav16k/STT_NW0121_0057_380382_to_387534.wav,འབྲུག་རྒྱལ་ཁབ་ཀི་བློན་ཆེན་འཇིགས་མེད་འཕྲིན་ལས་མཆོག་གིས་ཐེངས་དེའི་ལྷོ་ཨེ་ཤེ་ཡའ་མཐུན་ཚོགས་དེ་མཇུག་སྒྲིལ་བའི་གསལ་བསྒྲགས་གནང་འདུག
STT_NW0122_0000_1194_to_2927,ཐུགས་ཆེ་གནང་ནོར་བུ་བསམ་འཕེལ་ལགས།  ,thugs che gnang nor bu bsam 'phel lags/__,https://d38pmlk0v88drf.cloudfront.net/wav16k/STT_NW0122_0000_1194_to_2927.wav,STT_NW,2,34,1.733,wav16k/STT_NW0122_0000_1194_to_2927.wav,ཐུགས་ཆེ་གནང་ནོར་བུ་བསམ་འཕེལ་ལགས།
STT_NW0122_0001_2927_to_11398,རྣམ་པ་ཚོ་གཟའ་འཁོར་འདིའི་རྒྱལ་སྤྱིའི་གསར་འགྱུར་ནང་དྲ་རྒྱའི་བཟོ་ཚོང་ཁང་ཆེན་པོ་གྷོའུ་གྷེལ་གིས་རྒྱ་ནག་ནས་ཕྱིར་འཐེན་བྱེད་རྒྱུའི་ཉེན་བརྡ་བཏང་པའི་གནས་ཚུལ་ཆེན་པོ་ཆགས་སོང་བས། དོ་དགོང་དཔྱད་ཞིབ་ནང་ ,rnam pa tsho gza' 'khor 'di'i rgyal spyi'i gsar 'gyur nang dra rgya'i bzo tshong khang chen po g+ho'u g+hel gis rgya nag nas phyir 'then byed rgyu'i nyen brda btang pa'i gnas tshul chen po chags song bas/_do dgong dpyad zhib nang _,https://d38pmlk0v88drf.cloudfront.net/wav16k/STT_NW0122_0001_2927_to_11398.wav,STT_NW,2,187,8.471,wav16k/STT_NW0122_0001_2927_to_11398.wav,རྣམ་པ་ཚོ་གཟའ་འཁོར་འདིའི་རྒྱལ་སྤྱིའི་གསར་འགྱུར་ནང་དྲྭ་རྒྱའི་བཟོ་ཚོང་ཁང་ཆེན་པོ་གྷོའུ་གྷེལ་གིས་རྒྱ་ནག་ནས་ཕྱིར་འཐེན་བྱེད་རྒྱུའི་ཉེན་བརྡ་བཏང་པའི་གནས་ཚུལ་ཆེན་པོ་ཆགས་སོང་བས། དོ་དགོང་དཔྱད་ཞིབ་ནང་།
STT_NW0122_0002_11398_to_18771,རྩོམ་སྒྲིག་འགན་འཛིན་ཚེ་བརྟན་དབང་ཕྱུག་ལགས་དང་གནས་ཚུལ་དེ་སྤྱན་སྒྲོན་ཞུ་གི་ཡིན། ཚེ་བརྟན་དབང་ཕྱུག་ལགས། གྷོའུ་གྷེལ་བཟོ་ཚོང་ཁང་གིས་རྒྱ་ནག་ནས་ཕྱིར་འཐེན་བྱེད་རྒྱུའི་གནས་ཚུལ་ ,rtsom sgrig 'gan 'dzin tshe brtan dbang phyug lags dang gnas tshul de spyan sgron zhu gi yin/_tshe brtan dbang phyug lags/_g+ho'u g+hel bzo tshong khang gis rgya nag nas phyir 'then byed rgyu'i gnas tshul _,https://d38pmlk0v88drf.cloudfront.net/wav16k/STT_NW0122_0002_11398_to_18771.wav,STT_NW,2,166,7.373,wav16k/STT_NW0122_0002_11398_to_18771.wav,རྩོམ་སྒྲིག་འགན་འཛིན་ཚེ་བརྟན་དབང་ཕྱུག་ལགས་དང་གནས་ཚུལ་དེ་སྤྱན་སྒྲོན་ཞུ་གི་ཡིན། ཚེ་བརྟན་དབང་ཕྱུག་ལགས། གྷོའུ་གྷེལ་གཟོ་ཚོང་ཁང་གིས་རྒྱ་ནག་ནས་ཕྱིར་འཐེན་བྱེད་རྒྱུའི་གནས་ཚུལ་
STT_NW0122_0003_18771_to_22676,ཉེན་བརྡ་བཏང་པའི་གནས་ཚུལ་འདི་ཆགས་དགོས་པའི་རྒྱུ་རྐྱེན་གཙོ་བོ་དེ་ག་རེ་རེད་འདུག་གེ།  ,nyen brda btang pa'i gnas tshul 'di chags dgos pa'i rgyu rkyen gtso bo de ga re red 'dug ge/__,https://d38pmlk0v88drf.cloudfront.net/wav16k/STT_NW0122_0003_18771_to_22676.wav,STT_NW,2,81,3.905,wav16k/STT_NW0122_0003_18771_to_22676.wav,ཉེན་བརྡ་བཏང་པའི་གནས་ཚུལ་དེ་ཆགས་དགོས་པའི་རྒྱུ་རྐྱེན་གཙོ་བོ་དེ་ག་རེ་རེད་འདུག་གེ
STT_NW0122_0004_22676_to_30623,ད་རྒྱུ་རྐྱེན་ར་གཅིག་ག་ཟེར་དགོས་རེད། གཅིག་བཤད་སྟངས་མ་འདྲ་ཁ་ཤས་འདུག ད་གྷོའུ་གྷེལ་ཁོ་རང་ཚོ་བཟོ་ཚོང་ལས་ཁང་གིས་ཟེར་ཡ་བྱས་པ་ཡིན་ན། ཁོ་ཚོ་ད་གྷོའུ་གྷེལ་བཟོ་ཚོང་ལས་ཁང་ཟ་དེ་ཡིན་ན་ད་ ,da rgyu rkyen ra gcig ga zer dgos red/_gcig bshad stangs ma 'dra kha shas 'dug_da g+ho'u g+hel kho rang tsho bzo tshong las khang gis zer ya byas pa yin na/_kho tsho da g+ho'u g+hel bzo tshong las khang za de yin na da _,https://d38pmlk0v88drf.cloudfront.net/wav16k/STT_NW0122_0004_22676_to_30623.wav,STT_NW,2,172,7.947,wav16k/STT_NW0122_0004_22676_to_30623.wav,ད་རྒྱུ་རྐྱེན་ར་གཅིག་ག་རེ་ཟེར་དགོས་རེད། གཅིག་བཤད་སྟངས་མ་འདྲ་ཁ་ཤས་ཤིག་འདུག ད་གྷོའུ་གྷེལ་ཁོ་རང་ཚོའ་བཟོ་ཚོང་ལས་ཁང་ཟེར་ཡ་བྱས་པ་ཡིན་ན། ཁོ་ཚོས་ད་གྷོའུ་གྷེལ།་བཟོ་ཚོང་ལས་ཁང་ཟེར་དེ་ཡིན་ན་ད་
STT_NW0122_0005_30623_to_34674,དྲ་ལམ་ཐོག་ལ་ཡ་གནས་ཚུལ་གང་ལྟར་རྩད་གཅོད་བྱེད་ཡ་གི་ད་འཛམ་བུ་གླིང་ནང་ལ་ཆེ་ཤོས་དེ་རེད།  ,dra lam thog la ya gnas tshul gang ltar rtsad gcod byed ya gi da 'dzam bu gling nang la che shos de red/__,https://d38pmlk0v88drf.cloudfront.net/wav16k/STT_NW0122_0005_30623_to_34674.wav,STT_NW,2,83,4.051,wav16k/STT_NW0122_0005_30623_to_34674.wav,དྲ་ལམ་ཐོག་ལ་ཡ་གནས་ཚུལ་གང་ལྟར་རྩད་གཅོད་བྱེད་ཡ་གི་ད་འཛམ་བུ་གླིང་ནང་ཆེ་ཤོས་དེ་རེད།
