file_name,uni,wylie,url,dept,grade,char_len,audio_len,path,inf
STT_NW0118_0052_294570_to_303023,ད་དུང་ས་རུད་དང་ཆུ་རུད་ཀི་ཉེན་ཁ་ཡོད་པ་སོགས་ཀི་ཆེད་དུ་མཆོག་གསུམ་དགེ་བར་རྒྱ་མཚོར་ཕྱག་མཆོད་འབུལ་རྒྱ་གང་ཆེ་བྱེད་པ་དང་སྦྲགས།  ,da dung sa rud dang chu rud ki nyen kha yod pa sogs ki ched du mchog gsum dge bar rgya mtshor phyag mchod 'bul rgya gang che byed pa dang sbrags/__,https://d38pmlk0v88drf.cloudfront.net/wav16k/STT_NW0118_0052_294570_to_303023.wav,STT_NW,2,120,8.453,wav16k/STT_NW0118_0052_294570_to_303023.wav,ད་དུང་ས་རུད་དང་ཆུ་རུས་ཀི་ཉེན་ཁ་ཡོད་པ་སོགས་ཀི་ཆེད་དུ། མཆོག་གསུམ་རྒལ་བ་རྒྱ་མཚོར་ཕྱག་མཆོད་འབུལ་རྒྱ་གང་ཅི་བྱས་པ་དང་སྦྲགས།
STT_NW0118_0053_303023_to_304864,གདུང་ཤུགས་དྲག་པོའི་སྒོ་ནས་ ,gdung shugs drag po'i sgo nas _,https://d38pmlk0v88drf.cloudfront.net/wav16k/STT_NW0118_0053_303023_to_304864.wav,STT_NW,2,27,1.841,wav16k/STT_NW0118_0053_303023_to_304864.wav,གདུང་ཤུགས་དྲག་པོའི་སྒོ་ནས་
STT_NW0118_0054_304864_to_312957,བསྔོ་བ་སྨོན་ལམ་འུར་འདོན་བྱས་ཡོད་པ་རེད།  ,bsngo ba smon lam 'ur 'don byas yod pa red/__,https://d38pmlk0v88drf.cloudfront.net/wav16k/STT_NW0118_0054_304864_to_312957.wav,STT_NW,2,40,8.093,wav16k/STT_NW0118_0054_304864_to_312957.wav,བསྔོ་བ་སྨོན་ལམ་འུར་སྟོན་བྱས་ཡོད་པ་རེད།
STT_NW0118_0055_312957_to_316302,འདུ་ཚོགས་དེའི་ཐོག་བཙན་བྱོལ་བོད་གཞུང་ཆོས་རིགས་ལས་ཁུངས་ནས་ ,'du tshogs de'i thog btsan byol bod gzhung chos rigs las khungs nas _,https://d38pmlk0v88drf.cloudfront.net/wav16k/STT_NW0118_0055_312957_to_316302.wav,STT_NW,2,57,3.345,wav16k/STT_NW0118_0055_312957_to_316302.wav,འདུ་ཚོགས་དེའི་ཐོག་བཙན་བྱོལ་བོད་གཞུང་ཆོས་རིག་ལས་ཁུངས་ནས་
STT_NW0118_0056_316302_to_319944,གཙུག་ལག་ཁང་གི་རྟེན་མཆོག་སྤྱན་སྔར་མཆོད་སྤྲིན་སྟོང་ཚར་དང་ ,gtsug lag khang gi rten mchog spyan sngar mchod sprin stong tshar dang _,https://d38pmlk0v88drf.cloudfront.net/wav16k/STT_NW0118_0056_316302_to_319944.wav,STT_NW,2,56,3.642,wav16k/STT_NW0118_0056_316302_to_319944.wav,གཙུག་ལག་ཁང་གི་རྟན་མཆོག་སྤྱན་སྔར། མཆོས་སྤྲིན་སྟོང་གཚར་དང་
STT_NW0118_0057_319944_to_322624,འཕགས་མཆོག་འདུ་བ་རྒྱ་ཚོར་བསྙེན་བཀུར་དང་བཅས་ ,'phags mchog 'du ba rgya tshor bsnyen bkur dang bcas _,https://d38pmlk0v88drf.cloudfront.net/wav16k/STT_NW0118_0057_319944_to_322624.wav,STT_NW,2,43,2.68,wav16k/STT_NW0118_0057_319944_to_322624.wav,འཕགས་མཆོག་འདུད་པ་རྒྱ་མཚོར་བསྙེན་བཀུར་དང་བཅས་
STT_NW0118_0058_322624_to_324546,སྐྱབས་ཞུ་སྒྲོགས་སྱ་གནང་ཡོད་པ་རེད།  ,skyabs zhu sgrogs s+ya gnang yod pa red/__,https://d38pmlk0v88drf.cloudfront.net/wav16k/STT_NW0118_0058_322624_to_324546.wav,STT_NW,2,35,1.922,wav16k/STT_NW0118_0058_322624_to_324546.wav,སྐྱབས་ཞུ་སྒྲོག་སྦྱང་གནང་ཡོད་པ་རེད།
STT_NW0118_0059_324546_to_333899,ས་འགུལ་འཇིགས་པས་རྐྱེན་འདས་སུ་སོང་བ་རྣམས་ཀྱི་མཚོན། སེམས་ཅན་ཚེ་ལས་འདས་པ་ཡོངས་ཀྱིས་ཚེ་རབས་ཕྲེང་བ་གཞི་བཞག་བདེ་སྡུག་མཐའ་ལ་དག་ཞིང་ ,sa 'gul 'jigs pas rkyen 'das su song ba rnams kyi mtshon/_sems can tshe las 'das pa yongs kyis tshe rabs phreng ba gzhi bzhag bde sdug mtha' la dag zhing _,https://d38pmlk0v88drf.cloudfront.net/wav16k/STT_NW0118_0059_324546_to_333899.wav,STT_NW,2,125,9.353,wav16k/STT_NW0118_0059_324546_to_333899.wav,གསང་འཁོར་འཇིག་པའས་སྐྱེས་འདོན་དུ་སོང་བ་རྣམས་ཀྱིས་མཚོན། སེམས་ཅན་རྩེ་ལ་འདས་པ་ཡོངས་ཀྱིས་ཚེ་རབས་བྱུང་བ་ཞེས་ཟ། སྡིག་སྡུང་མཐའ་ལ་དག་ཤིང་
STT_NW0118_0060_333899_to_339024,ད་ནི་བདག་བསྐྱེད་རིམ་ཅན་གྱིས་སྐུ་བཞིའི་རྒྱལ་བའི་གོང་འཕངས་རིན་པོ་དབུ་ལ་ཐོབ་པ་དང་ ,da ni bdag bskyed rim can gyis sku bzhi'i rgyal ba'i gong 'phangs rin po dbu la thob pa dang _,https://d38pmlk0v88drf.cloudfront.net/wav16k/STT_NW0118_0060_333899_to_339024.wav,STT_NW,2,79,5.125,wav16k/STT_NW0118_0060_333899_to_339024.wav,བདག་ནི་བདག་ྒྱས་རིམ་བཅོན་ཀྱི་སྐུ་བཞིའི་རྒྱལ་བའི་ྒང་འཕང་རིན་པོ་ཆེ་དབུལ་དུ་ཐོབ་པ་དང་
STT_NW0118_0061_339024_to_347541,རྨས་སྐྱོན་གོ་ཆག། གོད་ཆགས་ཐོབ་པ་རྣམས་ཀྱང་མྱུལ་དུ་དྲག་སྐྱེད་ཀྱི་ཚེ་ལྷ་དོན་ལྡན་ཡོང་བ་གཙོས། ད་རེས་ཀི་ཆོས་འབྲེལ་གི་མཛད་སྒོ་དེ་གྲུབ་མཚམས་སུ་ ,rmas skyon go chag/_god chags thob pa rnams kyang myul du drag skyed kyi tshe lha don ldan yong ba gtsos/_da res ki chos 'brel gi mdzad sgo de grub mtshams su _,https://d38pmlk0v88drf.cloudfront.net/wav16k/STT_NW0118_0061_339024_to_347541.wav,STT_NW,2,135,8.517,wav16k/STT_NW0118_0061_339024_to_347541.wav,རྨས་རྐྱན་གོ་རྒྱབ་གོད་ཆག་ཐུག་པ་རྣམས་ཀྱང་མཉིས་དུ་དྲག་ཤེད་ཀི་ཚན་ལྔ་དོན་ལྡན་ཡོང་བ་གཙོ། ད་རེས་ཀི་ཆོས་འབྲེལ་གི་མཛད་སྒོ་དེ་གྲུབ་མཚམས་སུ་
STT_NW0118_0062_347541_to_352882,བཙན་བྱོལ་བོད་གཞུང་གི་ཆོས་རིག་བཀའ་བློན་མཆོག་ནས་འདུ་ཚོགས་ཀི་ངོ་བོའི་ཐོག་གསུང་ཡ་ལ་ ,btsan byol bod gzhung gi chos rig bka' blon mchog nas 'du tshogs ki ngo bo'i thog gsung ya la _,https://d38pmlk0v88drf.cloudfront.net/wav16k/STT_NW0118_0062_347541_to_352882.wav,STT_NW,2,80,5.341,wav16k/STT_NW0118_0062_347541_to_352882.wav,བཙན་བྱོལ་བོད་གཞུང་གི་ཆོས་རིག་བཀའ་བློན་མཆོག་ནས་འདུ་འཚོགས་ཀི་ངོ་བོའི་ཐོག་གསུང་ཡ་ལ།
STT_NW0118_0063_352882_to_361361,བྱེད་དུས་ཨེ་ནས་ཁ་སང་གནས་ཚུལ་ད་གོ་བ་དང་མཉམ་དུ་ཨེ་ནས་ལྷ་དང་བཅས་པ་གོང་ས་སྐྱབས་གནས། གོང་ས་སྐྱབས་མགོན་ཆེན་པོས་ཨེ་ནས་ཐུགས་སྨོན་མཚམས་སྦྱོར་ཆ་ཚང་གནང་པ་དང་། ལྷག་པར་དུ་ཡང་ ,byed dus e nas kha sang gnas tshul da go ba dang mnyam du e nas lha dang bcas pa gong sa skyabs gnas/_gong sa skyabs mgon chen pos e nas thugs smon mtshams sbyor cha tshang gnang pa dang /_lhag par du yang _,https://d38pmlk0v88drf.cloudfront.net/wav16k/STT_NW0118_0063_352882_to_361361.wav,STT_NW,2,162,8.479,wav16k/STT_NW0118_0063_352882_to_361361.wav,བྱེད་དུས་ ཨེ་ནས་ཁ་སང་གནས་ཟུལ་དུ་གོ་བ་དང་མཉམ་དུ་ ཨེ་ནས་ལྷ་དང་བཅས་པའི་གོང་ལུ་སྐྱབས་གནས་གོང་ས་སྐྱབས་མགོན་ཆེན་པོས་ཨེ་ནས་ཐུགས་སྨོན་མཚམས་སྦྱོར་ཆ་ཚང་གནང་བ་དང་། ལྷག་པར་དུ་ཡང་
STT_NW0118_0064_361361_to_368833,ཨེ་ནས་བོད་མི་དེ་ཚོ་ཚང་མ་ཡི་ཐོག་ལ་ད་ལྟ་སེམས་གསོའི་གི་ཨེ་ནས་འཚམས་འཕྲིན་གནང་ཡ་དང་དེ་ཚོ་ཚང་མ་གནང་ཚང་བ་རེད། ཨེ་ནས་དེའི་རྗེས་སུ་བཙན་བྱོལ་བོད་གཞུང་ ,e nas bod mi de tsho tshang ma yi thog la da lta sems gso'i gi e nas 'tshams 'phrin gnang ya dang de tsho tshang ma gnang tshang ba red/_e nas de'i rjes su btsan byol bod gzhung _,https://d38pmlk0v88drf.cloudfront.net/wav16k/STT_NW0118_0064_361361_to_368833.wav,STT_NW,2,141,7.472,wav16k/STT_NW0118_0064_361361_to_368833.wav,ཨེ་ནས་བོད་མི་དེ་ཚོ་ཚང་མི་ཐོག་ལ་ད་ལྟ་འདིར་སེམས་གསོ་གིས་ཨེ་ནས་འཚམས་འདྲི་གནང་ཡ་དང་། ད་དེ་ཚོ་ཚང་མ་གནང་ཚར་བ་རེད། ཨེ་ནས་དེའི་རྗེས་སུ་བཙན་བྱོལ་བོད་ྒྱུན་
STT_NW0118_0065_368833_to_370558,ང་རང་ཚོས་ད་ལྟ་འདི་ད།  ,nga rang tshos da lta 'di da/__,https://d38pmlk0v88drf.cloudfront.net/wav16k/STT_NW0118_0065_368833_to_370558.wav,STT_NW,2,22,1.725,wav16k/STT_NW0118_0065_368833_to_370558.wav,ང་རང་ཚོ་ད་ལྟ་འདིར་ད་
STT_NW0118_0066_370558_to_374217,གཞུང་ཞབས་ཡོངས་རྫོགས་ཁ་སང་ཕྱི་དྲོ་ཆུ་ཚོད་བཞི་དང་ཕྱེད་ཀ་གི་ཐོག་ནས་ ,gzhung zhabs yongs rdzogs kha sang phyi dro chu tshod bzhi dang phyed ka gi thog nas _,https://d38pmlk0v88drf.cloudfront.net/wav16k/STT_NW0118_0066_370558_to_374217.wav,STT_NW,2,65,3.659,wav16k/STT_NW0118_0066_370558_to_374217.wav,གཞུང་ཞབ་ཡོངས་རྫོགས་ཁ་སང་ཕྱི་རོལ་ཆུ་ཚོད་བཞི་ལ་ཕྱེད་ཀ་ཀི་ཐོག་ནས་
STT_NW0118_0067_374217_to_384016,ཨེ་ནས་མང་གཙོའི་ཀ་བ་གསུམ་གྱི་མཛད་གཙོ་རྣམ་པ་གིས་དབུས་བ་གིས་ཨེ་ནས་ཚང་མ་ལྷན་འཛོམས་བྱས་ནས་ཨེ་ནས་ཐུགས་སྨོན་མཚམས་སྦྱོར། བསྔོ་བ་སྨོན་ལམ་དེ་ཚོ་ཟབ་ཞིང་རྒྱས་པ་ཁ་སང་གནང་གྲུབ་པ་ཡིན། ཨེ་ནས་ད་རེས་འདིར།  ,e nas mang gtso'i ka ba gsum gyi mdzad gtso rnam pa gis dbus ba gis e nas tshang ma lhan 'dzoms byas nas e nas thugs smon mtshams sbyor/_bsngo ba smon lam de tsho zab zhing rgyas pa kha sang gnang grub pa yin/_e nas da res 'dir/__,https://d38pmlk0v88drf.cloudfront.net/wav16k/STT_NW0118_0067_374217_to_384016.wav,STT_NW,2,188,9.799,wav16k/STT_NW0118_0067_374217_to_384016.wav,ཨེ་ནས་ མང་གཙོའི་སཀལ་བ་གསུམ་གི་མཛད་གཙོམ་རྣམ་པ་དབུས་པ་གིས་ཨེ་ནས་ཚོང་མ་ལྷན་འཛོམས་བྱས་ནས་ ཨེ་ནས་ཐུགས་སྨོན་མཚམས་སྦྱོར་བསྔོ་བ་སྨོན་ལམ་དེ་ཚོ་ཟབ་བཞི་བརྒྱབ་པ་ཁ་སང་གནོང་འགྲོ་པ་ཡིན། ཨེ་ནས་ད་རིང་འདིར་
STT_NW0118_0068_384016_to_390858,ད་ལྟ་གོང་ནས་ཞུས་བ་ནང་བཞིན་གིས་སྐྱབས་ཡུལ་འཕགས་པ་གི་དགེ་འདུན་གི་སྡེ་ཨེ་ནས་ཁོང་ཚོ་ཚང་མའི་ཐོག་ལ་ཐུགས་སྨོན་མཚམས་སྦྱོར་དེ་འདྲས་བྱེད་ཀི་ཡོད་པ་དེ་འདྲས་གཅིག་ཡིན།  ,da lta gong nas zhus ba nang bzhin gis skyabs yul 'phags pa gi dge 'dun gi sde e nas khong tsho tshang ma'i thog la thugs smon mtshams sbyor de 'dras byed ki yod pa de 'dras gcig yin/__,https://d38pmlk0v88drf.cloudfront.net/wav16k/STT_NW0118_0068_384016_to_390858.wav,STT_NW,2,154,6.842,wav16k/STT_NW0118_0068_384016_to_390858.wav,ད་ལྟ་གོང་ནས་ཞུས་པ་ནང་བཞིན་གི་ཤབས་ཡོམ་འཕགས་པོའ་གི་དགེ་འདུན་གི་སྡེ། ཨེ་ནས་ཁོང་ཚོ་མཚོ་སྨད་གི་ཐོག་ལ་ཐུགས་སྨོན་ཚམ་སྤྱོད་དེ་འདྲས་བྱེད་ཀི་ཡོད་པ་དེ་འདྲས་གཅིག་ཡིན།
STT_NW0118_0069_390858_to_400331,བོད་མདོ་ཁམས་སྐྱེ་དགུ་མདོ་ཁུལ་དུ་ས་ཡོམ་གི་གོད་ཆགས་ཚབས་ཆེན་བྱུང་བས་ཐོག་བཙན་བྱོལ་ནང་ཡོད་པའི་བོད་མིའི་གནས་ཡུལ་གང་སར་སོ་སོའི་ལག་ཏུ་ཡོད་པ་ནི་ ,bod mdo khams skye dgu mdo khul du sa yom gi god chags tshabs chen byung bas thog btsan byol nang yod pa'i bod mi'i gnas yul gang sar so so'i lag tu yod pa ni _,https://d38pmlk0v88drf.cloudfront.net/wav16k/STT_NW0118_0069_390858_to_400331.wav,STT_NW,2,136,9.473,wav16k/STT_NW0118_0069_390858_to_400331.wav,བོད་མདོ་ཁམས་སྐྱེ་དྒོ་མྡོག་ཁུལ་དུ། ས་ཡོམ་གི་གོད་ཆགས་ཚབ་ཆེན་བྱུང་བའི་ཐོག བཙན་བྱོལ་ནང་ཡོད་པའི་བོད་མིའི་གནས་ཡུལ་གང་སར་སོ་སོའི་ལག་ཏུ་ཡོད་པ་ནི།
STT_NW0118_0070_400331_to_406904,མཆོག་གསུམ་ལ་སྨོན་ལམ་གསོལ་འདེབས་ཞུ་ཡ་ལས་མ་ཐུབ་པའི་གནས་སྟངས་དེའི་ཐོག་གང་ཡོང་ཅི་ཡོང་བྱས་བ་དང་སྦྲགས།  ,mchog gsum la smon lam gsol 'debs zhu ya las ma thub pa'i gnas stangs de'i thog gang yong ci yong byas ba dang sbrags/__,https://d38pmlk0v88drf.cloudfront.net/wav16k/STT_NW0118_0070_400331_to_406904.wav,STT_NW,2,98,6.573,wav16k/STT_NW0118_0070_400331_to_406904.wav,མཆོག་གསུམ་ལ་སྨོན་ལམ་གསོལ་འདེབས་ཞུ་ཡ་ལས་མ་ཐུབ་པའི་གནས་སྟངས་འདིའི་ཐོག་གང་ཡོང་ཅི་ཡོང་བྱེད་པ་དང་སྦྲགས།
STT_AB00651_0886_4129725_to_4133337,རྟེན་ཅིང་འབྲེལ་བར་འབྱུང་བ་གང་། དེ་ནི་འདུ་འཕྲོད་མཚན་ཉིད་དོ།  ,rten cing 'brel bar 'byung ba gang /_de ni 'du 'phrod mtshan nyid do/__,https://d38pmlk0v88drf.cloudfront.net/wav16k/STT_AB00651_0886_4129725_to_4133337.wav,STT_AB,2,60,3.612,wav16k/STT_AB00651_0886_4129725_to_4133337.wav,རྟེན་ཅིང་འབྲེལ་བར་འབྱུང་བ་གང་། དེ་ནི་འདུ་འཕྲོད་མཚན་ཉིད་དོ།
STT_AB00651_0891_4186611_to_4190222,སྐྱོབ་པའི་མི་འཇིགས་པ་རྣམས་ནི། ཤིན་ཏུ་བརྟན་པའི་ངོ་བོ་ཡིན།  ,skyob pa'i mi 'jigs pa rnams ni/_shin tu brtan pa'i ngo bo yin/__,https://d38pmlk0v88drf.cloudfront.net/wav16k/STT_AB00651_0891_4186611_to_4190222.wav,STT_AB,2,58,3.611,wav16k/STT_AB00651_0891_4186611_to_4190222.wav,སྐྱོབ་པའི་མི་འཇིགས་པ་རྣམས་ནི། ཤིན་ཏུ་བརྟན་པའི་ངོ་བོ་ཡིན།
STT_NW0118_0071_406904_to_412006,ཁུལ་དེར་ཚེ་འདས་སུ་གྱུར་བ་དང་། གོད་ཆགས་ཕོག་པའི་བོད་རིགས་སྤུན་ཟླ་ཚོའི་ཆེད་དུ་ ,khul der tshe 'das su gyur ba dang /_god chags phog pa'i bod rigs spun zla tsho'i ched du _,https://d38pmlk0v88drf.cloudfront.net/wav16k/STT_NW0118_0071_406904_to_412006.wav,STT_NW,2,76,5.102,wav16k/STT_NW0118_0071_406904_to_412006.wav,ཁུལ་དེར་ཚེ་ལདས་སུ་གྱུར་པ་དང་གོད་ཆགས་ཕོག་པའི་བོད་རིགས་སྤུན་ཟླ་ཚོའི་ཆེད་དུ་
STT_NW0118_0072_412006_to_417326,རྒྱལ་སྤྱིའི་རོགས་སྐྱོར་ཚོགས་སྡེ་ཁག་བརྒྱུད་དེ་མཐུན་འགྱུར་རོགས་རམ་སྤྲོད་ཕྱོགས་ཀི་ཐབས་ཤེས་ཀི་གཙོས་པའི་ ,rgyal spyi'i rogs skyor tshogs sde khag brgyud de mthun 'gyur rogs ram sprod phyogs ki thabs shes ki gtsos pa'i _,https://d38pmlk0v88drf.cloudfront.net/wav16k/STT_NW0118_0072_412006_to_417326.wav,STT_NW,2,100,5.32,wav16k/STT_NW0118_0072_412006_to_417326.wav,རྒྱལ་སྤྱིའི་རོགས་སྐྱོར་ཚོགས་སྡེ་ཁག་བརྒྱུད་དེ། མཐུན་འགྱུར་རོགས་རམ་སྤྲོད་ཕྱོགས་ཀི་ཐབས་ཤེས་ཀིས་གཙོས་པའི་
STT_NW0118_0073_417326_to_425693,ཧ་ཅང་ཡ་ང་བའི་གནས་སྟངས་དེའི་ཐོག་གང་འདྲ་ཅི་འདྲ་རྣམ་པའི་སྒོ་ནས་ལས་དོན་བྱེད་མུས་ཡིན་པའི་གནས་ཚུལ་རིམ་བཞིན་ཐོས་མོས་ཡིན་པ་རེད།  ,ha cang ya nga ba'i gnas stangs de'i thog gang 'dra ci 'dra rnam pa'i sgo nas las don byed mus yin pa'i gnas tshul rim bzhin thos mos yin pa red/__,https://d38pmlk0v88drf.cloudfront.net/wav16k/STT_NW0118_0073_417326_to_425693.wav,STT_NW,2,121,8.367,wav16k/STT_NW0118_0073_417326_to_425693.wav,ཧ་ཅང་ཡ་ང་བའི་གནས་སྟངས་འདིའི་ཐོག་གང་འདྲ་ཅི་འདྲའི་རྣམ་པའི་སྒོ་ནས་ལས་དོན་བྱེད་མུས་ཡིན་པའི་གནས་ཚུལ་རིམ་བཞིན་འཐུན་མོས་ཡིན་པ་རེད།
STT_NW0118_0074_425693_to_431980,ཨ་རིའི་གཞུང་དང་ཡོ་རོབ་སྤྱི་མཐུན་སོགས་ནས་ས་ཡོམ་གི་གོད་ཆགས་བྱུང་ཡུལ་བོད་སར་ཐུགས་གསོ་དང་རོགས་རམ་གནང་རྒྱུའི་གྲ་སྒྲིག་ཡིན་པ་གསུངས་འདུག།  ,a ri'i gzhung dang yo rob spyi mthun sogs nas sa yom gi god chags byung yul bod sar thugs gso dang rogs ram gnang rgyu'i gra sgrig yin pa gsungs 'dug/__,https://d38pmlk0v88drf.cloudfront.net/wav16k/STT_NW0118_0074_425693_to_431980.wav,STT_NW,2,132,6.287,wav16k/STT_NW0118_0074_425693_to_431980.wav,ཨ་རིའི་གཞུང་དང་ཡོ་རོབ་སྤྱི་མཐུན་སོགས་ནས་ས་ཡོམ་གི་གོད་ཆགས་བྱུང་ཡུལ་བོད་སར་ཐུགས་གསོ་དང་རོགས་རམ་གནང་རྒྱུར་གྲ་སྒྲིག་ཡིན་པ་གསུངས་འདུག
STT_NW0118_0075_431980_to_441508,སྒ་སྐྱེ་དགུ་མདོར་ས་ཁུལ་ལ་ས་ཡོམ་ཚབས་ཆེན་གི་གོད་ཆགས་ཕོག་པ་ཐམས་ཅད་ལ་ཨ་རི་གཞུང་ནས་ཐུགས་གསོ་དང་ས་གནས་ཀི་བོད་པ་ཚོར་སྐྱོབ་གསོའི་རོགས་རམ་བྱ་རྒྱུའི་གྲ་སྒྲིག་ཡིན་ཞེས་གསུངས་འདུག།  ,sga skye dgu mdor sa khul la sa yom tshabs chen gi god chags phog pa thams cad la a ri gzhung nas thugs gso dang sa gnas ki bod pa tshor skyob gso'i rogs ram bya rgyu'i gra sgrig yin zhes gsungs 'dug/__,https://d38pmlk0v88drf.cloudfront.net/wav16k/STT_NW0118_0075_431980_to_441508.wav,STT_NW,2,169,9.528,wav16k/STT_NW0118_0075_431980_to_441508.wav,སྒོ་སྐྱེ་དགུ་མདོའ་ས་ཁུལ་ལ་ས་ཡོམ་ཚབ་ཆེན་གི་གོད་ཆགས་ཕོག་པ་ཐམས་ཅད་ལ་ཨ་རིའི་གཞུང་ནས་ཐུགས་གསོ་དང་། ས་གནས་ཀི་བོད་པ་ཚོར་སྐྱོབ་གསོའི་རོགས་རམ་གནང་རྒྱུ་གྲ་སྒྲིག་ཡིན་ཅེས་གསུངས་འདུག
STT_NW0118_0076_441508_to_445953,རེས་གཟའ་ལྷག་པའི་ཉིན་ཨ་རིའི་ཕྱི་སྲིད་ལྷན་ཁང་གི་དྲུང་ཆེ་ལྕམ་ཧི་ལའེ་རའེ་ཁྀ་ལི་ཏོན་ནས་སྤྱི་བསྒྲགས་ཞིག་ནང་ ,res gza' lhag pa'i nyin a ri'i phyi srid lhan khang gi drung che lcam hi la'e ra'e kh-i li ton nas spyi bsgrags zhig nang _,https://d38pmlk0v88drf.cloudfront.net/wav16k/STT_NW0118_0076_441508_to_445953.wav,STT_NW,2,102,4.445,wav16k/STT_NW0118_0076_441508_to_445953.wav,རེས་གཟའ་ལྷག་པའི་ཉིན་ཨ་རིའི་ཕྱི་སྲིད་ལྷན་ཁང་གི་དྲུང་ཆེ་ལྕམ་ཧི་ལ་རི་ཁྀ་ལིན་ཊོ་ནས་ཕྱི་སྒྲགས་ཤིག་ན།
STT_NW0118_0077_445953_to_453125,ཨ་རིའི་མི་མང་གི་སྐུ་ཚབ་གནང་སྟེ། ས་ཡོམ་དེའི་འོག་སྒ་སྐྱེ་དགུ་མདོར་རང་གི་དགའ་ཉེ་སྤུན་མཆེད་འཐོར་བའི་ནང་མི་ཐམས་ཅད་ལ་ཐུགས་གསོ་གནང་གི་ཡོད་པ་གསུངས་འདུག།  ,a ri'i mi mang gi sku tshab gnang ste/_sa yom de'i 'og sga skye dgu mdor rang gi dga' nye spun mched 'thor ba'i nang mi thams cad la thugs gso gnang gi yod pa gsungs 'dug/__,https://d38pmlk0v88drf.cloudfront.net/wav16k/STT_NW0118_0077_445953_to_453125.wav,STT_NW,2,146,7.172,wav16k/STT_NW0118_0077_445953_to_453125.wav,ཨ་རིའི་མི་མང་གི་སྐུ་ཚབ་གནང་སྟེ། ས་ཡོམ་འདིའི་འོག་མགོ་སྐྱེ་དགུ་མདོར་རང་གི་དགའ་ཉེའ་སྤུན་མཆེད་དོར་བའི་ནང་མི་ཐམས་ཅད་ལ་ཐུགས་གསོ་གནང་གི་ཡོད་པ་གསུངས་འདུག
