file_name,uni,wylie,url,dept,grade,char_len,audio_len,path,inf
STT_NW0115_0066_398537_to_408013,དེབ་སྐྱེལ་གནང་རྒྱུའི་ཉིན་མཐའ་མ་དེ་ཡིན་པ་རེད། གཤམ་ལ་ཨེ་ཤི་ཡ་མངའ་ཁུལ་དུ། དེང་སྐབས་དམག་སྦྱོང་དང་དམག་ལས་ཀི་ཚོད་ལྟ། འདྲ་མིན་བྱུང་བཞིན་པའི་སྐོར་ཞིག པདྨ་བདེ་ཆེན་ལགས་ཀིས་སྙན་སྒྲོན་ཞུས་གནང་གི་རེད།  ,deb skyel gnang rgyu'i nyin mtha' ma de yin pa red/_gsham la e shi ya mnga' khul du/_deng skabs dmag sbyong dang dmag las ki tshod lta/_'dra min byung bzhin pa'i skor zhig_pad+ma bde chen lags kis snyan sgron zhus gnang gi red/__,https://d38pmlk0v88drf.cloudfront.net/wav16k/STT_NW0115_0066_398537_to_408013.wav,STT_NW,2,189,9.476,wav16k/STT_NW0115_0066_398537_to_408013.wav,དེབ་སྐྱེལ་གནང་རྒྱུའི་ཉིན་མཐའ་མ་དེ་ཡིན་པ་རེད། གཤམ་ལ་ཨེ་ཤེ་ཡ་མངའ་ཁུལ་དུ་དེང་སྐབས་དམག་སྦྱོང་དང་དམག་ལས་ཀི་ཚོད་ལྟ་འདྲ་མིན་བྱུང་བཞིན་པའི་སྐོར་ཞིག་པདྨ་བདེ་ཆེན་ལགས་ཀིས་སྙན་སྒྲོན་ཞུ་གནང་གི་རེད།
STT_NW0115_0067_408013_to_413536,དེང་གི་དུས་འདི་ནི། དམག་འཁྲུག་མེད་པར། ཞི་བའི་དུས་ཤིག་ཡིན་པ་ངོས་འཛིན་བྱེད་ཀི་ཡོད་པ་རེད་དེ།  ,deng gi dus 'di ni/_dmag 'khrug med par/_zhi ba'i dus shig yin pa ngos 'dzin byed ki yod pa red de/__,https://d38pmlk0v88drf.cloudfront.net/wav16k/STT_NW0115_0067_408013_to_413536.wav,STT_NW,2,90,5.523,wav16k/STT_NW0115_0067_408013_to_413536.wav,དོང་གི་དུས་འདི་ནི་དམག་འཁྲུག་མེད་པར་ཞི་བའི་དུས་ཤིག་ཡིན་པའི་ངོས་འཛིན་བྱེད་ཀི་ཡོད་པ་རེད་དེ།
STT_NW0115_0068_413536_to_418469,དེང་སང་ལྷོ་བྱང་ཀོ་རི་ཡ་གཉིས་དང་རྒྱ་ནག་བཅས་ཀིས། དམག་སྦྱོང་བྱེད་སྟངས་ལ་བལྟས་ན།  ,deng sang lho byang ko ri ya gnyis dang rgya nag bcas kis/_dmag sbyong byed stangs la bltas na/__,https://d38pmlk0v88drf.cloudfront.net/wav16k/STT_NW0115_0068_413536_to_418469.wav,STT_NW,2,78,4.933,wav16k/STT_NW0115_0068_413536_to_418469.wav,དེང་སང་ལྷོ་བྱང་ཀོ་རི་ཡ་གཉིས་དང་རྒྱ་ནག་བཅས་ཀིས་དམག་སྦྱོང་བྱེད་སྟངས་ལ་བལྟས་ན།
STT_NW0115_0069_418469_to_424792,ཞི་བའི་དུས་སུའང་། དམག་འཁྲུག་གི་གྲ་སྒྲིག་ཨང་གསར་བྱེད་རྒྱུ་དེ། བློས་བཏང་མེད་པ་ལྟ་བུ་ཆགས་ཡོད་ལ།  ,zhi ba'i dus su'ang /_dmag 'khrug gi gra sgrig ang gsar byed rgyu de/_blos btang med pa lta bu chags yod la/__,https://d38pmlk0v88drf.cloudfront.net/wav16k/STT_NW0115_0069_418469_to_424792.wav,STT_NW,2,94,6.323,wav16k/STT_NW0115_0069_418469_to_424792.wav,ཞི་བའི་དུས་སུའང་དམག་འཁྲུག་གི་གྲ་སྒྲིག་ཨང་གསར་བྱེད་རྒྱུ་དེ་བློས་བཏང་མེད་པ་ལྟ་བུ་ཆགས་ཡོད་པ་རེད་ལ།
STT_NW0115_0070_424792_to_430253,བྱེད་ལུགས་དེ་ཚོས། རྒྱལ་ཁབ་ཕན་ཚུན་དབར་དང་། དེ་བཞིན་འབྲེལ་ཡོད་ཁྱིམ་མཚེས་རྒྱལ་ཁབ་ཁག་གིས ,byed lugs de tshos/_rgyal khab phan tshun dbar dang /_de bzhin 'brel yod khyim mtshes rgyal khab khag gis_,https://d38pmlk0v88drf.cloudfront.net/wav16k/STT_NW0115_0070_424792_to_430253.wav,STT_NW,2,85,5.461,wav16k/STT_NW0115_0070_424792_to_430253.wav,བྱེད་ལུགས་དེ་ཚོས་རྒྱལ་ཁབ་ཕན་ཚུན་དབར་དང་། དེ་བཞིན་འབྲེལ་ཡོད་ཁྱིམ་མཚེས་རྒྱལ་ཁབ་ཁག་གིས་
STT_NW0115_0071_430253_to_435331,དོགས་པ་རྣམ་རྟོག་དང་། ཡིད་མ་ཆེས་བྱེད་པའི་དངངས་འཚབ་བྱེད་གཞིའི་གནས་སྟངས་ཤིག་བསྐྲུན་གི་ཡོད་པ་རེད།  ,dogs pa rnam rtog dang /_yid ma ches byed pa'i dngangs 'tshab byed gzhi'i gnas stangs shig bskrun gi yod pa red/__,https://d38pmlk0v88drf.cloudfront.net/wav16k/STT_NW0115_0071_430253_to_435331.wav,STT_NW,2,95,5.078,wav16k/STT_NW0115_0071_430253_to_435331.wav,དོགས་པ་རྣམ་རྟོག་དང་ཡིད་མ་ཆེས་བཆེ་བའི་དངངས་འཚབ་བྱེད་བཞིའི་གནས་སྟངས་ཤིག་བསྐྲུན་གི་ཡོད་པ་རེད།
STT_NW0115_0072_435331_to_444303,ལྷོ་ཀོ་རི་ཡ་གིས། ཁ་སང་གཟའ་ཕུར་བུའི་ཉིན་འགོ་བཙུགས་བྱས་པའི། ཉིན་གྲངས་ལྔའི་རྒྱ་མཚོ་སེར་པོའི་ཐོག་གི དམག་སྦྱོང་ཚ་ཚ་འུར་འུར་བྱེད་བཞིན་པ་དེ་ནི།  ,lho ko ri ya gis/_kha sang gza' phur bu'i nyin 'go btsugs byas pa'i/_nyin grangs lnga'i rgya mtsho ser po'i thog gi_dmag sbyong tsha tsha 'ur 'ur byed bzhin pa de ni/__,https://d38pmlk0v88drf.cloudfront.net/wav16k/STT_NW0115_0072_435331_to_444303.wav,STT_NW,2,138,8.972,wav16k/STT_NW0115_0072_435331_to_444303.wav,ལྷོ་ཀོ་རི་ཡ་ཡིས་ཁ་སང་གཟའ་ཕུར་བུའི་ཉིན་འགོ་བཙུགས་བྱས་པའི། ཉིན་གྲངས་ལྔའི་རྒྱ་མཚོ་སེར་པོའི་ཐོག་གི་དམག་སྦྱོང་ཚ་ཚ་འུར་འུག་བྱེད་བཞིན་པ་དེ་ནི།
STT_NW0115_0073_444303_to_449394,ད་བར་ཡུལ་དེར། མཚོ་ཐོགས་དམག་འཁྲུག་དམིགས་པའི་དམག་སྦྱོང་གཞི་རྒྱ་ཆེ་ཤོས་དེ་ཆགས་ཡོད་པ་རེད།  ,da bar yul der/_mtsho thogs dmag 'khrug dmigs pa'i dmag sbyong gzhi rgya che shos de chags yod pa red/__,https://d38pmlk0v88drf.cloudfront.net/wav16k/STT_NW0115_0073_444303_to_449394.wav,STT_NW,2,87,5.091,wav16k/STT_NW0115_0073_444303_to_449394.wav,ད་བར་ཡུལ་དེའི་མཚོ་ཐོག་དམག་འཁྲུག་དམིགས་པའི་དམག་སྦྱོང་གཞི་རྒྱ་ཆེ་ཤོས་དེ་ཆགས་ཡོད་པ་རེད།
STT_NW0115_0074_449394_to_451178,དེ་བཞིན་དམག་སྦྱོང་དེ་ཡང་།  ,de bzhin dmag sbyong de yang /__,https://d38pmlk0v88drf.cloudfront.net/wav16k/STT_NW0115_0074_449394_to_451178.wav,STT_NW,2,27,1.784,wav16k/STT_NW0115_0074_449394_to_451178.wav,དེ་བཞིན་དམག་སྦྱོང་དེ་ཡང་།
STT_NW0115_0075_451178_to_458362,དམག་འཁྲུག་ངོ་མ་རྒྱག་གི་ཡོད་པའི་ངར་ཤུགས་དང་། དམག་དོན་འཕྲུལ་རིགས་ལག་རྩལ་གི་ཐོག་ནས་བྱེད་ཀི་ཡོད་ཅེས། ལྷོ་ཀོ་རི་ཡའི་དམག་དཔོན།  ,dmag 'khrug ngo ma rgyag gi yod pa'i ngar shugs dang /_dmag don 'phrul rigs lag rtsal gi thog nas byed ki yod ces/_lho ko ri ya'i dmag dpon/__,https://d38pmlk0v88drf.cloudfront.net/wav16k/STT_NW0115_0075_451178_to_458362.wav,STT_NW,2,122,7.184,wav16k/STT_NW0115_0075_451178_to_458362.wav,དམག་འཁྲུག་ངོ་མ་རྒྱག་གི་ཡོད་པའི་ངར་ཤུགས་དང་། དམག་དོན་འཕྲུལ་རིགས་ལག་རྩལ་གི་ཐོག་ནས་བྱེད་ཀི་ཡོད་ཅེས། ལྷོ་ཀོ་རི་ཡའི་དམག་དཔོན་
STT_NW0115_0076_467869_to_474935,ང་ཚོས་དགྲ་བོའི་དམག་འཁྲུག་སློང་གཞིའི་ནུས་པ་རྩ་མེད་བཟོ་རྒྱུ་དང་། ནུབ་ཕྱོགས་རྒྱ་མཚོའི་ཐོག ང་ཚོའི་དམག་དོན་སྟོབས་ཤུགས་གོང་འཕེལ་དང་།  ,nga tshos dgra bo'i dmag 'khrug slong gzhi'i nus pa rtsa med bzo rgyu dang /_nub phyogs rgya mtsho'i thog_nga tsho'i dmag don stobs shugs gong 'phel dang /__,https://d38pmlk0v88drf.cloudfront.net/wav16k/STT_NW0115_0076_467869_to_474935.wav,STT_NW,2,128,7.066,wav16k/STT_NW0115_0076_467869_to_474935.wav,ང་ཚོས་དགྲ་བོའི་དམག་འཁྲུག་རླུང་གཞིའི་ནུས་པ་རྩ་མེད་བཟོ་རྒྱུ་དང་། ནུབ་ཕྱོགས་རྒྱ་མཚོའི་ཐོག་ང་ཚོའི་དམག་དོན་སྟོབས་ཤུགས་གོང་འཕེལ་དང་།
STT_NW0115_0077_474935_to_478601,དམག་འཐབ་བྱེད་རྒྱུར། གྲ་སྒྲིག་ཨང་གསར་བྱེད་རྒྱུའི་ཆེད་དུ་ཡིན།  ,dmag 'thab byed rgyur/_gra sgrig ang gsar byed rgyu'i ched du yin/__,https://d38pmlk0v88drf.cloudfront.net/wav16k/STT_NW0115_0077_474935_to_478601.wav,STT_NW,2,61,3.666,wav16k/STT_NW0115_0077_474935_to_478601.wav,དམག་འཐབ་བྱེད་རྒྱུར་གྲ་སྒྲིག་ཨང་གསར་བྱེད་རྒྱུའི་ཆེད་དུ་ཡིན།
STT_NW0115_0078_478601_to_482415,ད་རེས་ལྷོ་ཀོ་རི་ཡའི་དམག་སྦྱོང་དེ་ནི། ད་ལོ་སྤྱི་ཟླ་གསུམ་པའི་ནང་།  ,da res lho ko ri ya'i dmag sbyong de ni/_da lo spyi zla gsum pa'i nang /__,https://d38pmlk0v88drf.cloudfront.net/wav16k/STT_NW0115_0078_478601_to_482415.wav,STT_NW,2,65,3.814,wav16k/STT_NW0115_0078_478601_to_482415.wav,ད་རེས་ལྷོ་ཀོ་རི་ཡའི་དམག་སྦྱོང་དེ་ནི། ད་ལོ་སྤྱི་ཟླ་གསུམ་པའི་ནང་
STT_NW0115_0079_482415_to_490875,བྱང་ཀོ་རི་ཡ་གིས། ལྷོ་ཀོ་རི་ཡ་གི་དམག་གྲུ་ཞིག་ལ། འཚོ་འོག་འབར་མདེལ་གི་གཏོར་རྒོལ་དང་ཡིན་ལུགས་ཀི་གནས་ཚུལ་བྱུང་སའི་ཉེ་འཁྲིས་སུ་བྱེད་ཀི་ཡོད་པ་རེད།  ,byang ko ri ya gis/_lho ko ri ya gi dmag gru zhig la/_'tsho 'og 'bar mdel gi gtor rgol dang yin lugs ki gnas tshul byung sa'i nye 'khris su byed ki yod pa red/__,https://d38pmlk0v88drf.cloudfront.net/wav16k/STT_NW0115_0079_482415_to_490875.wav,STT_NW,2,141,8.46,wav16k/STT_NW0115_0079_482415_to_490875.wav,བྱང་ཀོ་རི་ཡ་ཡིས་ལྷོ་ཀོ་རི་ཡའི་དམག་འཁྲུ་ཞིག་ལ་འཚོ་བ་འབར་མདལ་གི་གཏོར་རྒོལ་དང་ཡིན་ལུགས་ཀི་གནས་ཚུལ་བྱུང་སའི་ཉེས་འཁྲིག་དུ་བྱེད་ཀི་ཡོད་པ་རེད།
STT_NW0115_0080_490875_to_495168,ཡང་བྱང་ཀོ་རི་ཡ་གིས། ཉེས་འཛུགས་དེར་ངོས་ལེན་བྱེད་ཀི་མེད་པའི་ཐོག་ལ།  ,yang byang ko ri ya gis/_nyes 'dzugs der ngos len byed ki med pa'i thog la/__,https://d38pmlk0v88drf.cloudfront.net/wav16k/STT_NW0115_0080_490875_to_495168.wav,STT_NW,2,66,4.293,wav16k/STT_NW0115_0080_490875_to_495168.wav,ཡང་བྱང་ཀོ་རི་ཡ་གིས་ཉེས་འཛུགས་དེར་ངོས་ལེན་བྱེད་ཀྱི་མེད་པའི་ཐོག་ལ།
STT_NW0115_0081_495168_to_505040,ལྷོ་ཀོ་རི་ཡ་ནས་དམག་སྦྱོང་རུ་ངར་པོ་དེ་འདྲ་ཞིག་བྱེད་བཞིན་པའི་ཐོག ཁ་སང་གཟའ་ཕུར་བུའི་ཉིན། ཡང་བསྐྱར་སྡེ་ཁུལ་འབྲོག་པའི་ཁ་རྡུང་དང་། སྐྱོན་བརྗོད་དྲག་པོ་བྱས་ཡོད་པ་རེད།  ,lho ko ri ya nas dmag sbyong ru ngar po de 'dra zhig byed bzhin pa'i thog_kha sang gza' phur bu'i nyin/_yang bskyar sde khul 'brog pa'i kha rdung dang /_skyon brjod drag po byas yod pa red/__,https://d38pmlk0v88drf.cloudfront.net/wav16k/STT_NW0115_0081_495168_to_505040.wav,STT_NW,2,160,9.872,wav16k/STT_NW0115_0081_495168_to_505040.wav,ལྷོ་ཀོ་རི་ཡ་ནས་དམག་སྦྱོང་རུ་ངར་པོ་འདི་འདྲ་ཞིག་བྱེད་བཞིན་པའི་ཐོག ཁ་སང་གཟའ་ཕུར་བུའི་ཉིན་ཡང་བསྐྱར་འདེ་སྐུལ་སྒྲོག་པའི་ཁ་རྡུང་དང་སྐྱོན་བརྗོད་དྲག་པོ་བྱས་ཡོད་པ་རེད།
STT_NW0115_0082_506846_to_515591,བྱང་ཀོ་རི་ཡ་གིས། ཁ་རྡུང་དང་སྐྱོན་བརྗོད་དེ་འདྲ་ཞིག་བྱེད་མིན་ལ་མ་ལྟོས་པར། ཉེ་ཆར་སྤྱི་ཟླ་བདུན་པའི་ནང་།  ,byang ko ri ya gis/_kha rdung dang skyon brjod de 'dra zhig byed min la ma ltos par/_nye char spyi zla bdun pa'i nang /__,https://d38pmlk0v88drf.cloudfront.net/wav16k/STT_NW0115_0082_506846_to_515591.wav,STT_NW,2,101,8.745,wav16k/STT_NW0115_0082_506846_to_515591.wav,བྱང་ཀོ་རི་ཡ་གིས་ཁ་རྡུང་དང་སྐྱོན་བརྗོད་དེ་འདྲ་ཞིག་བྱེད་མིན་ལ་མ་ལྟོས་པར་ཉེ་ཆར་སྤྱི་ཟླ་བདུན་པའི་ནང་
STT_NW0115_0083_515591_to_519940,ལྷོ་ཀོ་རི་ཡ་དང་ཨ་མེ་རི་ཀ་གཉིས། ཟུང་སྦྲེལ་གི་དམག་སྦྱོང་ཞིག་བྱས་ཡོད་པ་རེད།  ,lho ko ri ya dang a me ri ka gnyis/_zung sbrel gi dmag sbyong zhig byas yod pa red/__,https://d38pmlk0v88drf.cloudfront.net/wav16k/STT_NW0115_0083_515591_to_519940.wav,STT_NW,2,74,4.349,wav16k/STT_NW0115_0083_515591_to_519940.wav,ལྷོ་ཀོ་རི་ཡ་དང་ཨ་མེ་རི་ཀ་གཉིས་ཟུང་འབྲེལ་གི་དམག་སྦྱོང་ཞིག་བྱས་ཡོད་པ་རེད།
STT_NW0115_0084_519940_to_526978,ཀོ་རི་ཡ་ཕྱི་གླིང་གི ཤར་ཕྱོགས་རྒྱ་མཚོའི་ཐོག་གི་དམག་སྦྱོང་དེར། བྱང་ཀོ་རི་ཡ་དང་རྒྱ་ནག་གཉིས་ཀས་སྐྱོན་བརྗོད་ཤུགས་ཆེ་བྱས་འདུག ,ko ri ya phyi gling gi_shar phyogs rgya mtsho'i thog gi dmag sbyong der/_byang ko ri ya dang rgya nag gnyis kas skyon brjod shugs che byas 'dug_,https://d38pmlk0v88drf.cloudfront.net/wav16k/STT_NW0115_0084_519940_to_526978.wav,STT_NW,2,120,7.038,wav16k/STT_NW0115_0084_519940_to_526978.wav,ཀོ་རི་ཡ་ཕྱི་གླིང་གི་ཤར་ཕྱོགས་རྒྱ་མཚོའི་ཐོག་གི་དམག་སྦྱོང་དེར། བྱང་ཀོ་རི་ཡ་དང་རྒྱ་ནག་གཉིས་ཀས་སྐྱོན་བརྗོད་ཤུགས་ཆེ་བྱས་འདུག
STT_NW0115_0085_526978_to_536397,ཡིན་ནའང་། རྒྱ་ནག་རང་ཉིད་ཀིས། ཟླ་བ་འདིའི་ཚེས་གསུམ་གི་ཉིན་ནས་འགོ་བཙུགས་བྱས་ཏེ། ཉིན་གྲངས་ལྔའི་ཁ་མདོག་སྲུང་སྐྱོབ་ཀི་དམག་སྦྱོང་ཞིག་བྱེད་བཞིན་ཡོད་པ་རེད།  ,yin na'ang /_rgya nag rang nyid kis/_zla ba 'di'i tshes gsum gi nyin nas 'go btsugs byas te/_nyin grangs lnga'i kha mdog srung skyob ki dmag sbyong zhig byed bzhin yod pa red/__,https://d38pmlk0v88drf.cloudfront.net/wav16k/STT_NW0115_0085_526978_to_536397.wav,STT_NW,2,148,9.419,wav16k/STT_NW0115_0085_526978_to_536397.wav,ཡིན་ན་ཡང་། རྒྱ་ནག་རང་ཉིད་ཀིས་ཟླ་བ་འདིའི་ཚེས་གསུམ་གི་ཉིན་ནས་འགོ་བཛུགས་བྱས་ཏེ། ཉིན་གྲངས་ལྔའི་ཁ་མདོག་སྲུང་སྐྱོབ་ཀི་དམག་སྦྱོང་ཞིག་བྱེད་བཞིན་ཡོད་པ་རེད།
STT_NW0115_0086_536397_to_541687,དམག་སྦྱོང་དེར། ཕྱི་ལོ་ཉིས་སྟོང་བཅུ་ལོའི་མདུན་བསྐྱོད་སྲུང་དམག་ཅེས་པའི་མིང་བཏགས་ཡོད་པ་དང་།  ,dmag sbyong der/_phyi lo nyis stong bcu lo'i mdun bskyod srung dmag ces pa'i ming btags yod pa dang /__,https://d38pmlk0v88drf.cloudfront.net/wav16k/STT_NW0115_0086_536397_to_541687.wav,STT_NW,2,90,5.29,wav16k/STT_NW0115_0086_536397_to_541687.wav,དམག་སྦྱོང་དེར་ཕྱི་ལོ་ཉིས་སྟོང་བཅུ་ལོའི་བདུན་བསྐྱོད་སྲུང་དམག་ཞེས་པའི་མིང་བཏགས་ཡོད་པ་དང་།
STT_AB00649_0008_73499_to_77144,ལོ་རྒྱུས་ཐོག་གི་བོད་ཀྱི་སྲིད་འཛིན་གྲགས་ཅན་མང་ཆེ་བ་ལ།  ,lo rgyus thog gi bod kyi srid 'dzin grags can mang che ba la/__,https://d38pmlk0v88drf.cloudfront.net/wav16k/STT_AB00649_0008_73499_to_77144.wav,STT_AB,2,54,3.645,wav16k/STT_AB00649_0008_73499_to_77144.wav,ལོ་རྒྱུས་ཐོག་གི་བོད་ཀྱི་སྲིད་འཛིན་གྲགས་ཅན་མང་ཆེ་བ་ལ།
STT_NW0115_0087_541687_to_550255,རྒྱལ་ས་པེ་ཅིང་གི་ཉེ་འཁྲིས་སུ་ཆགས་པ། དབུས་ཕྱོགས་ཞིང་ཆེན་ཧཱ་ནན་དང་། ཤར་ཕྱོགས་མཚོ་ཁའི་ཞིང་ཆེན་ཧྲན་ཏུང་ནང་བྱེད་བཞིན་པའི་དམག་སྦྱོང་ནང་།  ,rgyal sa pe cing gi nye 'khris su chags pa/_dbus phyogs zhing chen hA nan dang /_shar phyogs mtsho kha'i zhing chen hran tung nang byed bzhin pa'i dmag sbyong nang /__,https://d38pmlk0v88drf.cloudfront.net/wav16k/STT_NW0115_0087_541687_to_550255.wav,STT_NW,2,132,8.568,wav16k/STT_NW0115_0087_541687_to_550255.wav,རྒྱལ་ས་པེ་ཅིན་གི་ཉེ་ཁྲིག་ཏུ་ཆགས་པ། དབུས་ཕྱོགས་ཞིང་ཆེན་ཧེ་ནན་དང་། ཤར་ཕྱོགས་མཚུ་ཁའི་ཞིང་ཆེན་ཧྲན་ཏུང་ནང་བྱེད་བཞིན་པའི་དམག་སྦྱོང་ནང་
STT_NW0115_0088_550255_to_556297,རྒྱ་ནག་གིས་ས་མཚོ་གནམ་གསུམ་གི་དམག་དཔུང་གི གནམ་གྲུ་བརྒྱ་ལྷག་ཅིག་བཀོད་སྒྲིག་བྱས་པའི་ཐོག་ནས།  ,rgya nag gis sa mtsho gnam gsum gi dmag dpung gi_gnam gru brgya lhag cig bkod sgrig byas pa'i thog nas/__,https://d38pmlk0v88drf.cloudfront.net/wav16k/STT_NW0115_0088_550255_to_556297.wav,STT_NW,2,90,6.042,wav16k/STT_NW0115_0088_550255_to_556297.wav,རྒྱ་ནག་གི་ས་མཙོ་གནམ་གསུམ་གི་དམག་དཔུང་གི་གནམ་གྲུ་བརྒྱ་ལྷག་ཞིག་བཀོད་སྒྲིག་བྱས་པའི་ཐོག་ནས་
STT_NW0115_0089_556297_to_562228,མེ་ཤུགས་འཕུར་མདའ་དངོས་སུ་འཕངས་ཏེ། རྒྱལ་ས་པེ་ཅིང་སྲུང་སྐྱོབ་བྱེད་སྟངས་ཀི་དམག་སྦྱོང་བྱེད་ཀི་ཡོད་པ་རེད།  ,me shugs 'phur mda' dngos su 'phangs te/_rgyal sa pe cing srung skyob byed stangs ki dmag sbyong byed ki yod pa red/__,https://d38pmlk0v88drf.cloudfront.net/wav16k/STT_NW0115_0089_556297_to_562228.wav,STT_NW,2,102,5.931,wav16k/STT_NW0115_0089_556297_to_562228.wav,མེ་ཤོགས་ཕུལ་མདའི་དངོས་སུ་འཕངས་ཏེ། རྒྱལ་ས་པེ་ཅིན་སྲུང་སྐྱོབ་བྱེད་སྟངས་ཀི་དམག་སྦྱོང་བྱེད་ཀི་ཡོད་པ་རེད།
STT_NW0115_0090_562228_to_569846,ཡང་རྒྱ་ནག་གིས། སོ་སོའི་དམག་སྦྱོང་དེ་ནི། ཕྱི་གསལ་ནང་གསལ་གི་ལས་དོན་བྱེད་ཐབས་ཤིག་ཡིན་པའི་འགྲེལ་བཤད་བརྒྱབ་ཀི་ཡོད་པ་རེད་དེ།  ,yang rgya nag gis/_so so'i dmag sbyong de ni/_phyi gsal nang gsal gi las don byed thabs shig yin pa'i 'grel bshad brgyab ki yod pa red de/__,https://d38pmlk0v88drf.cloudfront.net/wav16k/STT_NW0115_0090_562228_to_569846.wav,STT_NW,2,120,7.618,wav16k/STT_NW0115_0090_562228_to_569846.wav,ཡང་རྒྱ་ནག་གིས་སོ་སོའི་དམག་སྦྱོང་དེ་ནི། ཕྱི་གསལ་ནང་གསལ་གི་ལས་དོན་བྱེད་ཐབས་ཤིག་ཡིན་པའི་འགྲེལ་བཤད་བརྒྱབ་ཀི་ཡོད་པ་རེད་དེ།
STT_NW0115_0091_569846_to_576379,རྒྱ་ནག་གིས་དམག་དོན་སྟོབས་ཤུགས་ཇེ་ཆེར་གཏོང་བ་དང་། རང་སྲུང་གི་བྱ་སྤྱོད། སྤེལ་ཤུགས་ཆེ་བར་གཏོང་བཞིན་པ་དེར།  ,rgya nag gis dmag don stobs shugs je cher gtong ba dang /_rang srung gi bya spyod/_spel shugs che bar gtong bzhin pa der/__,https://d38pmlk0v88drf.cloudfront.net/wav16k/STT_NW0115_0091_569846_to_576379.wav,STT_NW,2,104,6.533,wav16k/STT_NW0115_0091_569846_to_576379.wav,རྒྱ་ནག་གི་དམག་དོན་སྟོབས་ཤུགས་ཇེ་ཆེར་གཏོང་བ་དང་། རང་སྲུང་ཀི་བྱ་སྤྱོད་སྤེལ་ཤུགས་ཆེ་བར་གཏོང་བཞིན་པ་དེར་
STT_NW0115_0092_576379_to_583076,ཉི་ཧོང་དང་ཐའེ་ཝན་གཙོ་བོར་གྱུར་བའི། མངའ་ཁུལ་ནང་། ཉེན་ཚབ་གྱུར་གཞིའི་བྱ་སྤྱོད་ཅིག་ལ་ངོས་འཛིན་བྱེད་ཀི་ཡོད་པ་རེད།  ,nyi hong dang tha'e wan gtso bor gyur ba'i/_mnga' khul nang /_nyen tshab gyur gzhi'i bya spyod cig la ngos 'dzin byed ki yod pa red/__,https://d38pmlk0v88drf.cloudfront.net/wav16k/STT_NW0115_0092_576379_to_583076.wav,STT_NW,2,110,6.697,wav16k/STT_NW0115_0092_576379_to_583076.wav,ཉི་ཧོང་དང་ཐའེ་ཝན་གཙོ་བོར་གྱུར་པའི་མངའ་ཁུལ་ནང་ཉིན་ཚབ་སྦྱོར་གཞིའི་བྱ་སྤྱོད་ཞིག་ལ་ངོས་འཛིན་བྱེད་ཀི་ཡོད་པ་རེད།
STT_NW0116_0000_0_to_7307,ཐུགས་ཆེ་གནང་། པདྨ་རྡོ་རྗེ་ལགས། རྣམ་པ་ཚོ་སྐུ་ཁམས་བཟང་།  ,thugs che gnang /_pad+ma rdo rje lags/_rnam pa tsho sku khams bzang /__,https://d38pmlk0v88drf.cloudfront.net/wav16k/STT_NW0116_0000_0_to_7307.wav,STT_NW,2,55,7.307,wav16k/STT_NW0116_0000_0_to_7307.wav,ཐུགས་རྗེ་གནང་། པདྨ་རྡོ་རྗེ་ལགས། རྣམ་པ་ཚོ་སྐུ་ཁམས་བཟང་།
