file_name,uni,wylie,url,dept,grade,char_len,audio_len,path,inf
STT_NW0112_0007_35954_to_43731,གལ་ཆེན་ཡིན་གསུང་གསལ། ཆེད་མངགས་ཀིས་བོད་ཀི་གནད་དོན་དེ་རྒྱལ་སྤྱིའི་གནས་ཚུལ་བཟོས་བཞག་པ་ཞིག་ག་གེ་མ་རེད། ཡིན་ན་ཡང་། རྒྱ་ནག་གཞུང་གིས་འདས་པ་གི་ལོ་ལྔ་བཅུའི་རིང་ལ་ ,gal chen yin gsung gsal/_ched mngags kis bod ki gnad don de rgyal spyi'i gnas tshul bzos bzhag pa zhig ga ge ma red/_yin na yang /_rgya nag gzhung gis 'das pa gi lo lnga bcu'i ring la _,https://d38pmlk0v88drf.cloudfront.net/wav16k/STT_NW0112_0007_35954_to_43731.wav,STT_NW,2,154,7.777,wav16k/STT_NW0112_0007_35954_to_43731.wav,ྱི་ཡིན་སུང་གསལ། ཆེད་མངགས་ཀི་བོད་ཀི་གནད་དོན་དེ་རྒྱལ་སྤྱིའི་གནས་ཚུལ་བཟོས་བཞག་པ་ི་ག་གེ་མ་རེད། ཡིན་ན་ཡང་། རྒྱ་ནག་གཞུང་གིས་འདས་པའ་གི་ལོ་ལྔ་བཅུའི་རིང་ལ་
STT_NW0112_0008_43731_to_53009,ཨེ་ནས་བྱེད་སྟངས་ཀི་ཐོག་ནས་ཨེ་ནས་བོད་ཀྱི་གནད་དོན་དེ་ད་ཆ་རྒྱལ་སྤྱི་གི་གལ་གནད་ཆེན་པོ་ཆགས་བསྡད་ཡོད་རེད་བ། འོན་ཀྱང་། གོང་ས་མཆོག་དམིགས་བསལ་སྐུ་ཚབ་རྒྱལ་རི་བློ་གྲོས་རྒྱལ་མཚན་ལགས་ཀིས་ ,e nas byed stangs ki thog nas e nas bod kyi gnad don de da cha rgyal spyi gi gal gnad chen po chags bsdad yod red ba/_'on kyang /_gong sa mchog dmigs bsal sku tshab rgyal ri blo gros rgyal mtshan lags kis _,https://d38pmlk0v88drf.cloudfront.net/wav16k/STT_NW0112_0008_43731_to_53009.wav,STT_NW,2,175,9.278,wav16k/STT_NW0112_0008_43731_to_53009.wav,ཨེ་ནས་བྱེད་སྟངས་ཀི་ཐོག་ནས་ཨེ་ནས་བོད་ཀི་གནད་དོན་དེ་ད་ཞག་རྒྱལ་སྤྱིའ་གི་གནད་དོན་གལ་གནད་ཆེན་པོ་གཅིག་ཆགས་བསྡད་ཡོད་རེད་བ། འོན་ཀྱང་གོང་ས་མཆོག་གི་དམིགས་བསལ་སྐུ་ཚབ་རྒྱ་རིགས་བླུ་གྲིས་རྒྱལ་མཚན་ལགས་ཀིས་
STT_NW0112_0009_53009_to_59026,ད་རེས་བོད་རྒྱའི་བར་གྲོས་མོལ་ཐེངས་བདུན་པ་དེ་བོད་མི་ཡོངས་དང་རྒྱལ་སྤྱིའི་ནང་ལ་རེ་འདོད་ཆེན་པོ་བྱས་པ་གཞིར་བཟུང་ ,da res bod rgya'i bar gros mol thengs bdun pa de bod mi yongs dang rgyal spyi'i nang la re 'dod chen po byas pa gzhir bzung _,https://d38pmlk0v88drf.cloudfront.net/wav16k/STT_NW0112_0009_53009_to_59026.wav,STT_NW,2,107,6.017,wav16k/STT_NW0112_0009_53009_to_59026.wav,ད་རེས་བོད་རྒྱའི་བར་གྲོས་མོལ་ཐེངས་བདུན་པ་འདི། བོད་མི་ཡོངས་དང་རྒྱལ་སྤྱིའི་ནང་ལ་རེ་འདུན་ཆེན་པོ་བྱས་པ་ཞིར་བཟུང་
STT_NW0112_0010_59026_to_62311,འདོད་བློ་ཁེངས་པ་ཞིག་བྱུང་མེད་ལུགས་གསུངས་ཡོད་པ་རེད། འདི་བ་ལ་ངེད་གཉིས་གཅིག་པུ་མ་རེད།  ,'dod blo khengs pa zhig byung med lugs gsungs yod pa red/_'di ba la nged gnyis gcig pu ma red/__,https://d38pmlk0v88drf.cloudfront.net/wav16k/STT_NW0112_0010_59026_to_62311.wav,STT_NW,2,84,3.285,wav16k/STT_NW0112_0010_59026_to_62311.wav,འདོད་བློ་ཁེངས་པ་ཞིག་བྱུང་མེད་ལུགས་གསུངས་ཡོད་པ་རེད། ངེད་གཉིས་གཅིག་པུ་མ་རེད།
STT_NW0112_0011_62311_to_70031,རྒྱལ་སྤྱིའི་ནང་ལ་ཡ་ཟེར་གི་འདུག་ག་། འཛམ་གླིང་རྒྱལ་ཁབ་ཀི་དབུ་ཁྲིད་རྣམ་པ་མང་པོས་བོད་དོན་ཐོག་ལ་དོ་སྣང་བྱེད་མྱི་མང་པོ་གཅིག་གིས་ད་རེས་ཏན་ཏན་རང་ ,rgyal spyi'i nang la ya zer gi 'dug ga /_'dzam gling rgyal khab ki dbu khrid rnam pa mang pos bod don thog la do snang byed myi mang po gcig gis da res tan tan rang _,https://d38pmlk0v88drf.cloudfront.net/wav16k/STT_NW0112_0011_62311_to_70031.wav,STT_NW,2,138,7.72,wav16k/STT_NW0112_0011_62311_to_70031.wav,རྒྱལ་སྤྱིའི་ནང་ལ་ཡིན་ན་ཟེར་གི་འདུག་། འཛམ་གླིང་རྒྱལ་ཁབ་ཀི་དབུ་ཁྲིད་རྣམ་པ་མང་པོ་ བོད་དོན་ཐོག་ལ་དོས་སྣང་བཤེད་མྱན་མང་པོ་གཅིག་གིས ད་རིང་ཏན་ཏན་རང་
STT_NW0112_0012_70031_to_75924,ཨེ་ནས་རྒྱ་ནག་གཞུང་གིས་སྔར་ལས་ལྷག་པ་གིས་གཅིག་རྣམ་འགྱུར་བཟང་པོ་གཅིག་སྟོན་ཡ་གི་གོ་སྐབས་གཅིག་རེད།  ,e nas rgya nag gzhung gis sngar las lhag pa gis gcig rnam 'gyur bzang po gcig ston ya gi go skabs gcig red/__,https://d38pmlk0v88drf.cloudfront.net/wav16k/STT_NW0112_0012_70031_to_75924.wav,STT_NW,2,95,5.893,wav16k/STT_NW0112_0012_70031_to_75924.wav,ཨེ་ནས་རྒྱ་ནག་གཞུང་གིས་སྔར་ལས་ལྷག་པའ་གི་གཅིག་རྣམ་འགྱུར་བཟང་པོ་གཅིག་སྟོན་ཡ་གི་གོ་སྐབས་གཅིག་རེད།
STT_NW0112_0013_75924_to_79143,དེ་ཏན་ཏན་ངེས་པར་དུ་གཅིག་སྟོན་གི་བསམ་པ་གཅིག་གི་ ,de tan tan nges par du gcig ston gi bsam pa gcig gi _,https://d38pmlk0v88drf.cloudfront.net/wav16k/STT_NW0112_0013_75924_to_79143.wav,STT_NW,2,47,3.219,wav16k/STT_NW0112_0013_75924_to_79143.wav,དེ་ཏན་ཏན་ངེས་པར་དུ་གཅིག་སྟོན་གི་རེད་བསམ་པ་གཅིག་གི་
STT_NW0112_0014_79143_to_86540,ད་བསམ་ཚུལ་དེ་ཡོངས་གྲགས་གཅིག་ཆགས་བསྡད་ཡོད་རེད་བ། ང་རང་ཚོའི་བོད་པའི་སྤྱི་ཚོགས་ནང་ལ་ཏན་ཏན་ཆགས་ཡོད་རེད། རྒྱལ་སྤྱིའི་སྤྱི་ཚོགས་ནང་ཆགས་བསྡད་ཡོད་རེད། ང་རང་ཚོའི་བཙན་བྱོལ་གི་ ,da bsam tshul de yongs grags gcig chags bsdad yod red ba/_nga rang tsho'i bod pa'i spyi tshogs nang la tan tan chags yod red/_rgyal spyi'i spyi tshogs nang chags bsdad yod red/_nga rang tsho'i btsan byol gi _,https://d38pmlk0v88drf.cloudfront.net/wav16k/STT_NW0112_0014_79143_to_86540.wav,STT_NW,2,166,7.397,wav16k/STT_NW0112_0014_79143_to_86540.wav,ད་བསམ་ཚུལ་དེ་ཡང་དྲག་གཅིག་ཆགས་བསྡད་ཡོད་རེད་བ། ང་རང་ཚོ་བོད་པའི་སྤྱི་ཚོགས་ནང་ལ་ཏན་ཏན་ཆགས་ཡོད་རེད། རྒྱལ་སྤྱིའི་སྤྱི་ཚོགས་ནང་ལ་ཆགས་བསྡད་ཡོད་རེད། ཨེ་ནས་ང་རང་ཚོ་བཙན་བྱོལ་གི་
STT_NW0112_0015_86540_to_91257,སྒྲིག་འཛུགས་ཀི་དབུ་ཁྲིད་རྣམ་པའི་ཐུགས་ལ་ཡིན་ན་འདུག་སེ་བྱུང་པ་རེད། དེ་འདྲས་ཡིན་པ་ཡིན་ཙང་། དེ་འདྲས་ཀི་ཨེ་ནས་བསམ་ཚུལ་གཅིག་ ,sgrig 'dzugs ki dbu khrid rnam pa'i thugs la yin na 'dug se byung pa red/_de 'dras yin pa yin tsang /_de 'dras ki e nas bsam tshul gcig _,https://d38pmlk0v88drf.cloudfront.net/wav16k/STT_NW0112_0015_86540_to_91257.wav,STT_NW,2,119,4.717,wav16k/STT_NW0112_0015_86540_to_91257.wav,སྒྲིག་འཛོགས་ཀི་དབུ་ཁྲིད་རྣམ་པ་ཐུགས་ལ་ཡ་ན་འདུག་སེ་བྱུང་པ་རེད། དེ་འདྲས་ཡིན་པ་ཡིན་ཙང་། དེ་འདྲས་ཀི་ཨེ་ནས་བསམ་ཚུལ་གཅིག
STT_NW0112_0016_91257_to_94063,ད་དེ་འདྲས་ཀི་གནས་ཚུལ་ཞིག་གི་འོག་ལ་ད་དུང་ཡང་ ,da de 'dras ki gnas tshul zhig gi 'og la da dung yang _,https://d38pmlk0v88drf.cloudfront.net/wav16k/STT_NW0112_0016_91257_to_94063.wav,STT_NW,2,44,2.806,wav16k/STT_NW0112_0016_91257_to_94063.wav,ད་དེ་འདྲས་ཀི་གནས་ཚུལ་གཅིག་འོག་ལ་ད་དུང་ཡང་།
STT_NW0112_0017_94063_to_99616,ཨེ་ནས་གཅིག་ད་ལྟའི་དཀའ་ངལ་སེལ་ཡ་ཐོག་ལ་ཨེ་ནས་མདུན་བསྐྱོད་མ་བྱེད་པ་བྱས་བྱས།  ,e nas gcig da lta'i dka' ngal sel ya thog la e nas mdun bskyod ma byed pa byas byas/__,https://d38pmlk0v88drf.cloudfront.net/wav16k/STT_NW0112_0017_94063_to_99616.wav,STT_NW,2,74,5.553,wav16k/STT_NW0112_0017_94063_to_99616.wav,ཨེ་ནས་ཨགཅིག་ད་ལྟའ་དཀའ་ངལ་སེལ་ཡ་གི་ཐོག་ལ་ཨེ་ནས་འདོན་བསྐྱོད་མ་བྱས་པ་བྱས་བྱས།
STT_NW0112_0018_99616_to_108032,ཨེ་ནས། སྔར་རྒྱུན་གཞིར་བཟུང་བྱས་བྱས་ལངས་ཕྱོགས་བྱས་པ་དེ་གི་ཐོག་ནས། ཨེ་ནས་ང་ཚོས། ག་རེ་ཟེར་ཨ། དེ་རིང་བློ་ཁ་མ་ཚིམས་པའི་གནས་ཚུལ་གཅིག་ ,e nas/_sngar rgyun gzhir bzung byas byas langs phyogs byas pa de gi thog nas/_e nas nga tshos/_ga re zer a/_de ring blo kha ma tshims pa'i gnas tshul gcig _,https://d38pmlk0v88drf.cloudfront.net/wav16k/STT_NW0112_0018_99616_to_108032.wav,STT_NW,2,128,8.416,wav16k/STT_NW0112_0018_99616_to_108032.wav,ཨེ་ནས་ལྔ་རྒྱོན་ཞུ་བཟུང་བྱས་བྱས། ་ནསལང་ཕྱོག་བྱས་པ་དེ་གི་ཐོག་ནས། ཨེ་ནས་ང་ཚོ་ག་རེ་ཟ། དེ་རིང་ློ་ཁ་མ་ཟིན་པའི་གནས་ཚུལ་གཅིག
STT_NW0112_0019_108032_to_115210,གཙོ་བོ་ཆགས་ཡ་དེའི་ཐོག་ནས་རྒྱུ་མཚན་གཅིག་བཤད་ཀི་ཡོད་རེད། ཡང་སྐུ་ཞབས་བློ་གྲོས་རྒྱལ་མཚན་ལགས་ཀིས་བོད་ཀི་རྩ་དོན་གི་ཐོག་ལ་ ,gtso bo chags ya de'i thog nas rgyu mtshan gcig bshad ki yod red/_yang sku zhabs blo gros rgyal mtshan lags kis bod ki rtsa don gi thog la _,https://d38pmlk0v88drf.cloudfront.net/wav16k/STT_NW0112_0019_108032_to_115210.wav,STT_NW,2,116,7.178,wav16k/STT_NW0112_0019_108032_to_115210.wav,གཙོ་བོ་ཆགས་ཡ་དེ། དེའི་ཐོག་ནས་རྒྱུ་མཚན་གཅིག་བཤད་ཀི་ཡོད་རེད། ཡང་སྐུ་ཞབས་རྒྱ་རིགས་བླུ་གྲོས་རྒྱལ་མཚན་ལགས་ཀིས་བོད་ཀི་རྩ་དོན་གི་ཐོག་ལ་
STT_NW0112_0020_115210_to_119359,བོད་ཀི་གཞོན་ནུ་ལྷན་ཚོགས་ཀི་ལངས་ཕྱོགས་དེ་ནི་དབུ་མའི་ཐབས་ལམ་དང་མ་མཐུན་པ་ཞིག་ཡོད་རུང་།  ,bod ki gzhon nu lhan tshogs ki langs phyogs de ni dbu ma'i thabs lam dang ma mthun pa zhig yod rung /__,https://d38pmlk0v88drf.cloudfront.net/wav16k/STT_NW0112_0020_115210_to_119359.wav,STT_NW,2,85,4.149,wav16k/STT_NW0112_0020_115210_to_119359.wav,བོད་ཀི་གཞོན་ནུ་ལྷན་ཚོགས་ཀི་ལངས་ཕྱོགས་དེ་ནི་དབུ་མའི་ཐབས་ལམ་དང་མི་མཐུན་པ་ཞིག་ཡོད་རུང་།
STT_NW0112_0021_119359_to_126662,རྒྱ་ནག་གཞུང་གིས་བོད་ཀྱི་གཞོན་ནུ་ལྷན་ཚོགས་དེ་དྲག་འཐབ་པའི་སྒྲིག་འཛུགས་གཅིག་ཡིན་པའི་སྐྱོན་བརྗོད་ཐད་ལ་ངོས་ལེན་རྩ་བ་ནས་བྱེད་ཐབས་ཡོད་མ་རེད་ཅེས་ནན་བརྗོད་གནང་ཡོད་པ་རེད།  ,rgya nag gzhung gis bod kyi gzhon nu lhan tshogs de drag 'thab pa'i sgrig 'dzugs gcig yin pa'i skyon brjod thad la ngos len rtsa ba nas byed thabs yod ma red ces nan brjod gnang yod pa red/__,https://d38pmlk0v88drf.cloudfront.net/wav16k/STT_NW0112_0021_119359_to_126662.wav,STT_NW,2,162,7.303,wav16k/STT_NW0112_0021_119359_to_126662.wav,རྒྱ་ནག་གཞུང་གིས་བོད་ཀི་གཞོན་ནུ་ལྷན་ཚོགས་ཀི་དྲག་ཐབ་པའི་སྒྲིག་འཛུགས་གཅིག་ཡིན་པའི་སྐྱོན་བརྗོད་ཐད་ལ་ངོས་ལེན་རྩ་བ་ནས་བྱེད་ཐབས་ཡོད་མ་རེད་ཅེས་ནན་བརྗོད་གནང་ཡོད་པ་རེད།
STT_NW0112_0022_126662_to_131286,བོད་མིའི་སྒྲིག་འཛུགས་དེ་ཡང་ང་རང་ཚོའི་བོད་པའི་སྤྱི་ཚོགས་ནང་ལ་ཡོད་པའི་གལ་གནད་ཅན་གི་སྒྲིག་འཛུགས་ཆགས་བསྡད་ཡོད་རེད།  ,bod mi'i sgrig 'dzugs de yang nga rang tsho'i bod pa'i spyi tshogs nang la yod pa'i gal gnad can gi sgrig 'dzugs chags bsdad yod red/__,https://d38pmlk0v88drf.cloudfront.net/wav16k/STT_NW0112_0022_126662_to_131286.wav,STT_NW,2,112,4.624,wav16k/STT_NW0112_0022_126662_to_131286.wav,བོད་ལུབ་སྒྲིག་འཛུགས་དེ་ཡང་ང་རང་ཚོ་བོད་པའི་སྤྱི་ཚོགས་ནང་ལ་ཡོད་པའ་གི་གལ་གནད་ྐཅན་གི་སྒྲིག་འཛུགས་ཆགས་བསྡད་ཡོད་རེད།
STT_NW0112_0023_131286_to_137651,ད་ལྟའི་རྒྱལ་པ་རིན་པོ་ཆེ་གིས་དབུ་ཁྲིད་པ་གི་ཡང་གཞུང་། མང་ཚོགས་གཞུང་དེ་ཡང་བོད་མི་ཡོངས་རྗོགས་ཀི་གཞུང་ཆགས་བསྡད་ཡོད་རེད། དེ་འདྲས་ཆ་ནས། ཨེ་ནས།  ,da lta'i rgyal pa rin po che gis dbu khrid pa gi yang gzhung /_mang tshogs gzhung de yang bod mi yongs rjogs ki gzhung chags bsdad yod red/_de 'dras cha nas/_e nas/__,https://d38pmlk0v88drf.cloudfront.net/wav16k/STT_NW0112_0023_131286_to_137651.wav,STT_NW,2,137,6.365,wav16k/STT_NW0112_0023_131286_to_137651.wav,ད་ལྟའི་རྒྱལ་བ་རིན་པོ་ཆེ་དབུ་ཁྲིད་པའ་གི་ཡང་མངས་གཙོ་གཞུང་དེ་ཡང་བོད་མི་ཡངས་རྫོགས་ཀི་གཞུང་ཆགས་བསྡད་ཡོད་རེད། དེ་འདྲས་ཆ་ནས་ཨེ་ནས་
STT_AB00648_0007_50549_to_55307,བོད་མི་རིགས་ཀྱི་དད་གུས་དང་བློ་གཏད་ཡིད་ཆེས་ཞུ་སའི་སྐྱེས་བུ་གཙོ་བོ་ཞིག་དང་།  ,bod mi rigs kyi dad gus dang blo gtad yid ches zhu sa'i skyes bu gtso bo zhig dang /__,https://d38pmlk0v88drf.cloudfront.net/wav16k/STT_AB00648_0007_50549_to_55307.wav,STT_AB,2,75,4.758,wav16k/STT_AB00648_0007_50549_to_55307.wav,བོད་མི་རིགས་ཀྱི་དད་གུས་དང་བློ་གཏད་ཡིད་ཆེས་ཞུ་སའི་སྐྱེས་བུ་གཙོ་བོ་ཞིག་དང་།
STT_NW0112_0024_137651_to_144350,སྒྲིག་འཛུགས་ད་ག་དང་དཀྱིལ་འཁོར་ད་ག་ནང་ཡོད་མྱི་གི་སྡེ་ཚན་གཅིག་གི་ཐོག་ལ་ཨེ་ནས་གཞི་མེད་པ་གི་རྦད་དེ་ཞྭ་མོ་ཆེན་པོ་གཅིག་གཡོགས་ཡོང་པ་ཡིན་ན།  ,sgrig 'dzugs da ga dang dkyil 'khor da ga nang yod myi gi sde tshan gcig gi thog la e nas gzhi med pa gi rbad de zhwa mo chen po gcig g.yogs yong pa yin na/__,https://d38pmlk0v88drf.cloudfront.net/wav16k/STT_NW0112_0024_137651_to_144350.wav,STT_NW,2,133,6.699,wav16k/STT_NW0112_0024_137651_to_144350.wav,སྒྲིག་འཛུགས་ད་ག་དང་དཀྱིལ་འཁོར་ད་ག་ནང་ལ་ཡོད་མྱི་གི་སྡེ་ཚན་གཅིག་གི་ཐོག་ལ་ཨེ་ནསགཞི་མེད་པའ་གི་ེ་ནསརྦད་དེ་ཞྭས་མོ་ཆེན་པོ་གཅིག་གཡོགས་ཡོང་པ་ཡིན་ན།
STT_NW0112_0025_144350_to_151017,དེ་ཨེ་ནས་ག་རེ་ཟེར་ཨ། ང་ཚོ། ཁས་ལེན་མ་བྱས་ཡ་དེ། ངེད་གཉིས་ཀི་འགན་ཡིན་པ་ཡིན་ཙང་། ཞེ་དྲག་གིས་རྦད་དེ་ཤུགས་ཆེན་པོའི་ཐོག་ནས་བཤད་པ་ཡིན།  ,de e nas ga re zer a/_nga tsho/_khas len ma byas ya de/_nged gnyis ki 'gan yin pa yin tsang /_zhe drag gis rbad de shugs chen po'i thog nas bshad pa yin/__,https://d38pmlk0v88drf.cloudfront.net/wav16k/STT_NW0112_0025_144350_to_151017.wav,STT_NW,2,128,6.667,wav16k/STT_NW0112_0025_144350_to_151017.wav,དེ་ཨེ་ནས་ག་རེ་ཟ། ང་ཚོས་ཁས་ལེན་མ་བྱེད་ཡ་དེ། ང་གཉིས་ཀི་འགན་ཡིན་པ་ཡིན་ཙང་། ཞེ་དྲག་རྦད་དེ་ཤུགས་ཆེན་པོའི་ཐོག་ནས་བཤད་པ་ཡིན།
STT_NW0112_0026_151017_to_154605,ད་རེས་གོང་ས་སྐྱབས་མགོན་ཆེན་པོ་མཆོག་གི་སྐུ་ཚབ་རྣམ་པའི་དགོངས་ཚུལ་བྱས་ན།  ,da res gong sa skyabs mgon chen po mchog gi sku tshab rnam pa'i dgongs tshul byas na/__,https://d38pmlk0v88drf.cloudfront.net/wav16k/STT_NW0112_0026_151017_to_154605.wav,STT_NW,2,71,3.588,wav16k/STT_NW0112_0026_151017_to_154605.wav,ད་རེས་གོང་ས་སྐྱབས་མགོན་ཆེན་པོ་མཆོག་གི་སྐུ་ཚབ་རྣམ་པས་དགོངས་ཚུལ་བྱས་ན་
STT_NW0112_0027_154605_to_164180,རྒྱ་ནག་གི་འགོ་ཁྲིད་ཚོས་རྒྱ་ནག་མི་རིགས་ཆེན་པོའི་ལྟ་བ་ཟེར་བ་མཁྲེགས་འཛིན་དང་། དེ་བཞིན་བོད་ཀི་ཐོག་ལ་རྒྱ་ནག་གི་ཁྲིམས་ལུགས་ཀི་བདག་དབང་གི་གནད་དོན་དེའི་ཐོག་ལ་ཚོར་རྐྱེན་ཧ་ཅང་ཆེན་པོ་ཡོད་པ་སོགས་ལ་བརྟེན་ནས་ ,rgya nag gi 'go khrid tshos rgya nag mi rigs chen po'i lta ba zer ba mkhregs 'dzin dang /_de bzhin bod ki thog la rgya nag gi khrims lugs ki bdag dbang gi gnad don de'i thog la tshor rkyen ha cang chen po yod pa sogs la brten nas _,https://d38pmlk0v88drf.cloudfront.net/wav16k/STT_NW0112_0027_154605_to_164180.wav,STT_NW,2,195,9.575,wav16k/STT_NW0112_0027_154605_to_164180.wav,རྒྱ་ནག་གི་འགོ་ཁྲིད་ཚོས་རྒྱ་ནག་མི་རིགས་ཆེན་པོས་ལྟ་བ་ཟེར་བ་མཁྲིག་འཛིན་དང་། དེ་བཞིན་བོད་ཀི་ཐོག་ལ་རྒྱ་ནག་གི་ཁྲིམས་ལུགས་ཀི་དག་དབང་གི་གནད་དོན་དེའི་ཐོག་ལ་ཚོར་རྐྱེན་ཧ་ཅང་ཆེན་པོ་ཡོད་པ་སོགས་ལ་བརྟེན་ནས་
STT_NW0112_0028_164180_to_170130,བོད་རྒྱའི་བར་གྲོས་མོལ་དེ་དག་གོ་ཐོག་ལ་འགོག་རྐྱེན་བཟོ་གི་ཡོད་པ་མ་ཟད། ད་རེས་འབྲེལ་མོལ་འདིའི་སྐབས་སུ་ཡང་ ,bod rgya'i bar gros mol de dag go thog la 'gog rkyen bzo gi yod pa ma zad/_da res 'brel mol 'di'i skabs su yang _,https://d38pmlk0v88drf.cloudfront.net/wav16k/STT_NW0112_0028_164180_to_170130.wav,STT_NW,2,101,5.95,wav16k/STT_NW0112_0028_164180_to_170130.wav,བོད་རྒྱའི་དབར་འགྲོལ་མོལ་དེ་དག་གི་ཐོག་ལ་འགོག་རྐྱེན་བཟོ་གི་ཡོད་པ་མ་ཟད། ད་རེས་འབྲེལ་མོལ་འདིའི་སྐབས་སུ་ཡང་
STT_NW0112_0029_170130_to_171230,རྒྱ་ནག་གིས་ ,rgya nag gis _,https://d38pmlk0v88drf.cloudfront.net/wav16k/STT_NW0112_0029_170130_to_171230.wav,STT_NW,2,12,1.1,wav16k/STT_NW0112_0029_170130_to_171230.wav,རྒྱ་ནག་གིས་
STT_NW0112_0030_171230_to_178900,རྒྱལ་སྤྱིའི་ཐོག་ལ་མཐོང་ཚུལ་བཟང་པོ་ཞིག་འཛིན་རྒྱུའི་གོ་སྐབས་བཟང་པོ་དེའི་ཁེ་ཕན་ལེན་ཐུབ་མེད་པ་རེད། དེ་འདྲས་ཀི་གནས་ཚུལ་མང་པོ་ཞེ་བོ་གཅིག་ ,rgyal spyi'i thog la mthong tshul bzang po zhig 'dzin rgyu'i go skabs bzang po de'i khe phan len thub med pa red/_de 'dras ki gnas tshul mang po zhe bo gcig _,https://d38pmlk0v88drf.cloudfront.net/wav16k/STT_NW0112_0030_171230_to_178900.wav,STT_NW,2,132,7.67,wav16k/STT_NW0112_0030_171230_to_178900.wav,རྒྱལ་སྤྱིའི་ཐོག་ལ་མཐོང་ཚུལ་བཟང་པོ་ཞིག་འཛིན་རྒྱུའི་གོ་སྐབས་བཟང་པོ་དེ་ཁེ་ཕན་ལེན་ཐུབ་མེད་པ་རེད། དེ་འདྲས་ཀི་གནས་ཚུལ་མང་པོ་ཞེ་བོ་གཅིག
STT_NW0112_0031_178900_to_186028,བྱུང་བྱས། དེ་འདྲས་ཡིན་པ་ཡིན་ཙང་། ཨེ་ནས་རྒྱ་ནག་གི་ད་ལྟ་ཕྱི་ཟླ་བརྒྱད་པའི་ནང་ལོག་ལ་ད་རྒྱལ་སྤྱིའི་རྩེད་མོ་འགྲན་བསྡུར་དེ་ཡང་ཡོད་པ་བྱས། དེ་འདྲས་ཀི་ཐོག་ནས་ད་མང་པོ་གཅིག་གིས་ ,byung byas/_de 'dras yin pa yin tsang /_e nas rgya nag gi da lta phyi zla brgyad pa'i nang log la da rgyal spyi'i rtsed mo 'gran bsdur de yang yod pa byas/_de 'dras ki thog nas da mang po gcig gis _,https://d38pmlk0v88drf.cloudfront.net/wav16k/STT_NW0112_0031_178900_to_186028.wav,STT_NW,2,166,7.128,wav16k/STT_NW0112_0031_178900_to_186028.wav,བྱུང་བྱས་དེ་འདྲས་ཡིན་པ་ཡིན་ཙང་། ཨེ་ནསརྒྱ་ནག་གི་ད་ལྟ་ཕྱི་ཟླ་བརྒྱད་པའི་ནང་ལོགས་ལ་ད་རྒྱལ་སྤྱིའི་ཀི་རྩེད་མོ་འགྲན་བསྡུར་དེ་ཡང་ཡོད་པ་བྱས། དེ་འདྲས་ཀི་ཐོག་ནས་ད་མང་པོ་གཅིག་གིས་
